14,cottonbuds1235,,[],,text,False,False,1548965550,self.curlyhair,https://www.reddit.com/r/curlyhair/comments/altniu/devacurl_delight_made_my_hair_dry_brittleprotein/,,altniu,True,False,False,True,False,#fb7f72,one,[],762e5196-21dd-11e6-90ce-0ebfe7658481,help,light,text,False,False,True,11,0,False,all_ads,/r/curlyhair/comments/altniu/devacurl_delight_made_my_hair_dry_brittleprotein/,False,,,6,1548965551,,1,"Hi, I've been following the cgm for about 6 months now. I got a Deva cut back in August 2018 and was introduced to the DevaCurl Delight series. (I have 2c-3a curls, very fine hair, and *maybe* low-porosity hair? I tried the Baobab &amp; Tea tree oils low porosity protein-free conditioner but I felt like it didn't moisturize my hair enough.)

My hair seemed to love these products during the summer (I live in an EXTREMELY humid climate), so I went on and purchased the BIG bottles. Once it started to get colder though, I noticed that my hair was getting dry and brittle. I did a deep condition with Melt into Moisture but my hair felt like straw as soon as I applied the conditioner and gel!! I experimented by adjusting the amount I used or by keeping the conditioner for a longer period of time, but nothing really worked. 

Has anyone experienced something similar to this? If yes, what was the cause? Protein overload? Or lack of moisture? How did you overcome that situation? Did the LOC method help you? 

I've been using Acure Organic's Argan Oil series with the Beautiful Curls Defining Gel and since this incident and so far I really like the results! My hair feels soft and moisturized. 

I have a sneaky suspicion that I have protein sensitive hair but don't want the DevaCurl products to go to waste!! 

Any kind of advice is greatly appreciated! ",True,False,False,curlyhair,t5_2t79l,161938,public,self,,,DevaCurl Delight made my hair dry &amp; brittle...Protein overload? Or lack of moisture?,https://www.reddit.com/r/curlyhair/comments/altniu/devacurl_delight_made_my_hair_dry_brittleprotein/,all_ads,6,False,t2_20l5j56e,,,"{'gid_1': 0, 'gid_2': 0, 'gid_3': 0}",True,False,,,,,,,,,,,,
15,KingEyob,,[],,text,False,False,1551554431,self.curlyhair,https://www.reddit.com/r/curlyhair/comments/awl84i/beginner_east_african_hair_so_a_lot_of_online/,,awl84i,True,False,False,True,False,,eight,[],,curl type,dark,text,False,False,True,12,0,False,all_ads,/r/curlyhair/comments/awl84i/beginner_east_african_hair_so_a_lot_of_online/,False,,,6,1551554432,,2,"I haven't grown my hair out since middle school, so this is the only picture I have of my grown out hair: [a disproportionate afro](https://imgur.com/a/BKrJOP7). I'm growing the top of my hair out more now, but it'll take time. I just decided to start CGM, here's the routine I'm planning on using:

Daily: Co-wash with VO5 Kiwi Lime using a Tangle Teezer. LOC with Cantu Shea Butter Leave-In, Argan Oil, and DevaCurl Styling Cream.

Once every 3 days: DevaCurl Low-Poo

Once a week: Shea Moisture 10-in-1 Hair Masque, leave in hair for 30 minutes and then wash off.

----

1.) What hair type am I? I'm a little lost when it comes to all the numbers and the 2B 3C etc.

2.) Is there a way to make your curls wavier? I have a fade on the sides and would like wavier bigger curls on the top of my head. 

3.) Should I do LOC right out of the shower with soaking-wet hair? And should I apply everything using a Tangle Teezer or just my hands?

4.) Is there anything in general with the routine I could change for the better? I avoid coconut because I tried Cantu Coconut Curling Cream and it made my hair very strawlike and dry.",True,False,False,curlyhair,t5_2t79l,169760,public,self,,,"Beginner. East African hair, so a lot of online black hair advice doesn't help. Questions about LOC, hair type, and routine.",https://www.reddit.com/r/curlyhair/comments/awl84i/beginner_east_african_hair_so_a_lot_of_online/,all_ads,6,False,t2_xi9x3,,,"{'gid_1': 0, 'gid_2': 0, 'gid_3': 0}",True,False,,1553966653.0,,,,,,,,,,
16,gajillionaire,,[],,text,False,False,1551643437,self.curlyhair,https://www.reddit.com/r/curlyhair/comments/awxwb9/any_wavies_here_using_the_loc_method_liquid_oil/,,awxwb9,True,False,False,True,False,#0266b3,four,[],8a0f6380-21dd-11e6-9e78-0ead3f7791ed,discussion,light,text,False,False,True,4,0,False,all_ads,/r/curlyhair/comments/awxwb9/any_wavies_here_using_the_loc_method_liquid_oil/,False,,,6,1551643438,,3,,True,False,False,curlyhair,t5_2t79l,169898,public,self,,,"Any wavies here using the “LOC” method (liquid, oil, cream)? My hair stylist recommended it, but I’m wary to try— I’m a low porosity wavy. Anyone using this method successfully? Which products are you loving?",https://www.reddit.com/r/curlyhair/comments/awxwb9/any_wavies_here_using_the_loc_method_liquid_oil/,all_ads,6,False,t2_2qxh7q7l,,,"{'gid_1': 0, 'gid_2': 0, 'gid_3': 0}",True,False,,1553980518.0,,,,,,,,,,
17,larniebarney,,[],,text,False,False,1551804197,i.redd.it,https://www.reddit.com/r/curlyhair/comments/axn6zt/day_3_of_following_a_combination_of_the_curly/,,axn6zt,True,False,True,False,False,,,[],,,dark,text,False,False,True,3,0,False,all_ads,/r/curlyhair/comments/axn6zt/day_3_of_following_a_combination_of_the_curly/,False,,,6,1551804198,,19,,True,False,False,curlyhair,t5_2t79l,170578,public,default,,,"Day 3 of following a combination of the curly girl method + LOC. DevaCurl gel has been fantastic so far, oil treatment has been thickening up my roots, and significantly less breakage all around!",https://i.redd.it/t1al5k23xbk21.png,all_ads,6,False,t2_2qppt6j8,,,"{'gid_1': 0, 'gid_2': 0, 'gid_3': 0}",True,False,,1554007895.0,,,,,,,,,,
18,katherinez,,[],,text,False,False,1552075140,i.redd.it,https://www.reddit.com/r/curlyhair/comments/ayukst/i_got_my_hair_colored_and_got_a_new_fresh_deva/,,ayukst,True,False,True,False,False,,,[],,,dark,text,False,False,True,26,0,False,all_ads,/r/curlyhair/comments/ayukst/i_got_my_hair_colored_and_got_a_new_fresh_deva/,False,,,6,1552075141,,368,,True,False,False,curlyhair,t5_2t79l,171339,public,default,,,"I got my hair colored and got a new fresh deva cut last night. She put in the new Deva spray oil that is coming out next month. Most deva products still make me frizz... But I LOVED this oil. She did ""Loc."" Leave in, oil and cream. I will definately be getting the oil next month! I have 3b/c.",https://i.redd.it/6ilfxrknayk21.jpg,all_ads,6,False,t2_4tfka,,,"{'gid_1': 0, 'gid_2': 0, 'gid_3': 0}",True,False,,1554052318.0,,,,,,,,,,
19,Sinthe741,,[],,text,False,False,1552494952,self.curlyhair,https://www.reddit.com/r/curlyhair/comments/b0o2eo/dry_time_with_braided_hair/,,b0o2eo,True,False,False,True,False,#fb7f72,one,[],762e5196-21dd-11e6-90ce-0ebfe7658481,help,light,text,False,False,True,6,0,False,all_ads,/r/curlyhair/comments/b0o2eo/dry_time_with_braided_hair/,False,,,6,1552494954,,3,"I have wavy hair, about a 2c, and I have a lot of it. Very thick (not the strands, just quantity), and about waist length. My go to routine is the LOC method (gel for the C) right out of the shower, and then I braid my hair into two pigtails right above my ears. I don't have the patience to blow dry my hair, and I'm not brave enough to let it air dry. I always shower at night, and this will not change.

My issue is the monumental amount of time it takes for my hair to dry! I thought it took a long time when I did a single braid (I switched to two for better definition), and that two would be faster because more hair is exposed to the air but that was a fuckin lie. I took my hair down at about 10:30 this morning, almost 12 hours after I braided it, and my hair was still wet! Do I just need to make time to dig my mom's 25-year-old dryer out and dry the braids? Am I sleeping wrong (back sleeper with the braids laid up over the pillow)? Should I plop for awhile to let more moisture soak up, or maybe do more braids? Does flaxseed gel really have to feel like snot? Help me fix my life!",True,False,False,curlyhair,t5_2t79l,174297,public,self,,,Dry time with braided hair?,https://www.reddit.com/r/curlyhair/comments/b0o2eo/dry_time_with_braided_hair/,all_ads,6,False,t2_rpycg,,,"{'gid_1': 0, 'gid_2': 0, 'gid_3': 0}",True,False,,1554098704.0,,,,,,,,,,
20,lDOG5454,,[],,text,False,False,1552745924,self.curlyhair,https://www.reddit.com/r/curlyhair/comments/b1swxl/tips_for_male_african_american_hair/,,b1swxl,True,False,False,True,False,,,[],,,dark,text,False,False,True,2,0,False,all_ads,/r/curlyhair/comments/b1swxl/tips_for_male_african_american_hair/,False,,,6,1552745926,,6,"Hi I'm new here and was directed here. I am a Male African American trying to grow out my hair and I'm not expert in the hair field so I came for so advice. So I have low porosity and I have trouble making sure my scalp or roots of my hair come in contact with the whatever I put in my hair. I have an afro ( a rather small one) and I want to know what the best way is to make sure oils and conditioner and what not get in there. Also as far as growing and strengthening hair is concerned I usually use water, then black castor oil, and then leave in conditioner in that order for the LOC method. My hair does seem oily afterward so I feel like I'm either putting too much oil in or it's not being absorbed? I'm not sure which one. Does anyone have tips on how to really make sure oils are not just sitting on the top on my head? 

Thanks",True,False,False,curlyhair,t5_2t79l,175233,public,self,,,Tips for Male African American hair,https://www.reddit.com/r/curlyhair/comments/b1swxl/tips_for_male_african_american_hair/,all_ads,6,False,t2_35qtl6db,,,"{'gid_1': 0, 'gid_2': 0, 'gid_3': 0}",True,False,,1554167386.0,,,,,,,,,,
21,jillolantern,,[],,text,False,False,1552855502,self.curlyhair,https://www.reddit.com/r/curlyhair/comments/b29rz4/curly_girl_method_fail_what_did_i_do_wrong/,,b29rz4,True,False,False,True,False,#fb7f72,one,[],762e5196-21dd-11e6-90ce-0ebfe7658481,help,light,text,False,False,True,6,0,False,all_ads,/r/curlyhair/comments/b29rz4/curly_girl_method_fail_what_did_i_do_wrong/,False,,,6,1552855503,,5,"I tried LOC this morning and my hair turned into a matted single curl with tons of white flakes everywhere :( 

I applied Shea moisture’s leave in conditioner on wet hair (half a handful) followed by almond oil, then Cantu’s curl cream (half a handful) , and then Ecos gel. The creams matted in my roots like white dandruff and the gel matted my entire head into a single curl. I couldn’t move my hand through it, so I ended up washing everything out. I only used half a handful of the gel before realizing my hair was a hot mess.

This was my first time trying LOC method. Before this, I just used the beginner method with no issues at all. I was hoping LOC would define my curls and remove remaining frizz.",True,False,False,curlyhair,t5_2t79l,175823,public,self,,,Curly girl method fail... what did I do wrong?,https://www.reddit.com/r/curlyhair/comments/b29rz4/curly_girl_method_fail_what_did_i_do_wrong/,all_ads,6,False,t2_278236f5,,,"{'gid_1': 0, 'gid_2': 0, 'gid_3': 0}",True,False,,1554177243.0,,,,,,,,,,
22,ohdamngiiina,,[],,text,False,False,1555552902,self.curlyhair,https://www.reddit.com/r/curlyhair/comments/beg361/trouble_embracing_natural_hair/,,beg361,True,False,False,True,False,,,[],,,dark,text,False,False,True,7,0,False,all_ads,/r/curlyhair/comments/beg361/trouble_embracing_natural_hair/,False,,,6,1555552904,,7,"This is me venting...kind of: 

Am I the only one that feels ashamed for *still* hating their natural curls? I love the natural movement and so badly want to be apart of it...but I just hate my hair so much. 

I’ve always had the most horrid relationship with my hair, often contemplating shaving it all off just because I hate it....so, SO much. I don’t feel confident with curly hair and I live in the Bible Belt, so...I always was teased and told I was ugly because of it growing up. 

I’m 28 now and the kicker- I’m a licensed cosmetologist. I have access to almost everything and I still can’t seem to get my hair to a) grow on the sides and b) look good when curly. I can only throw my hair up into a pineapple or bun and it *always* looks sloppy and messy and ends up a frizz ball by noon.

I do all the things to help my hair, get regular cuts..never use chemicals or heat on it and it’s still just dreadful. I don’t pull my hair too tight when I wear it up and sleep with a satin pillowcase. 

I also think a large part of why I hate my hair is because of the drastic difference in curls that I have on my head. The bulk of it is a 2b/c wave and then the outer perimeter is like a 3b/3c curl. I have very little breakage and I know my porosity is low to medium. I follow the LOC method and that has definitely improved my  curly definition but it’s not enough. My hair is also naturally very frizzy. 

I just feel so defeated. I don’t think I’m ever going to embrace my curls and not feel ugly af when I wear them. 😒",True,False,False,curlyhair,t5_2t79l,190572,public,self,,,Trouble embracing natural hair,https://www.reddit.com/r/curlyhair/comments/beg361/trouble_embracing_natural_hair/,all_ads,6,False,t2_xvou3,,,"{'gid_1': 0, 'gid_2': 0, 'gid_3': 0}",True,False,,1555662677.0,,,,,,,,,,
23,-NixiePixie-,,[],,text,False,False,1556073092,self.curlyhair,https://www.reddit.com/r/curlyhair/comments/bgp7lh/wavy_bleached_hair/,,bgp7lh,True,False,False,True,False,,,[],,,dark,text,False,False,True,2,0,False,all_ads,/r/curlyhair/comments/bgp7lh/wavy_bleached_hair/,False,,,6,1556073093,,1,"Hello :) I am new to this sub, but not new to the curly girl technique. I have been doing some form of it for about 6 months now (sulfate, paraben, silicone free, heat free, CWC with modified LOC, plopping while drying) . My issue/problem is this and I wanted to get others advice or insight. I have double processed bleached blonde hair (currently pink atm). I would say my hair is normally a 2a but can go up to a 2c if I scrunch/plop/and use gel. My worry is all the manipulation of scrunching or pulsing is causing breakage. I know because my hair is bleached I do have more of a tendency for breakage. I would love to encourage more of my curl pattern, but am too afraid. Does anyone else have an issue with this? What are your thoughts?",True,False,False,curlyhair,t5_2t79l,192395,public,self,,,Wavy bleached hair,https://www.reddit.com/r/curlyhair/comments/bgp7lh/wavy_bleached_hair/,all_ads,6,False,t2_1xpxwr05,,,"{'gid_1': 0, 'gid_2': 0, 'gid_3': 0}",True,False,,1556159481.0,,,,,,,,,,
24,SirRemmingtonIV,,[],,text,False,False,1556210385,self.curlyhair,https://www.reddit.com/r/curlyhair/comments/bhasoi/need_help_with_my_curls/,,bhasoi,True,False,False,True,False,,one,[],,help,dark,text,False,False,True,10,0,False,all_ads,/r/curlyhair/comments/bhasoi/need_help_with_my_curls/,False,,,6,1556210386,,1,"Alright so I have been trying so many different routines for my hair and none of them seem to be giving any hopeful results. I believe my hair type is 3b and it's short on the top (2inches or so) and trimmed around the sides and back. It's always dry no matter what I put in it or do to it and it's frustrating! I could soak my hair in a mixture of oil for hours and when I rinse it out, it just looks back at me in the mirror like ""what moisture? I didn't get any."" 

I've been trying all different kinds of products. At first I would just use a leave in conditioner which was not doing it. Then I started looking into the LOC method which I tried a range of products while doing (still do) and then I found my hair type which gave me other products to try but STILL no luck. Also, I don't shampoo my hair often like all forums say, about twice a week. Ive done deep condition treatments every now and then but they change nothing so far.

If I could post pictures to this I would but I'm new to Reddit and it gave me the option to either do picture or text so...

Please post any help or advice you lovely people may have because I feel like I've tried everything and there just isn't a fix for my hair!!",True,False,False,curlyhair,t5_2t79l,192704,public,self,,,Need help with my curls!!,https://www.reddit.com/r/curlyhair/comments/bhasoi/need_help_with_my_curls/,all_ads,6,False,t2_3nufc6ny,,,"{'gid_1': 0, 'gid_2': 0, 'gid_3': 0}",True,False,,1556296815.0,,,,,,,,,,
25,Justapotato8,,[],,text,False,False,1556439218,i.redd.it,https://www.reddit.com/r/curlyhair/comments/bi93b2/day_1_of_loc_method/,,bi93b2,True,False,True,False,False,,,[],,,dark,text,False,False,True,1,0,False,all_ads,/r/curlyhair/comments/bi93b2/day_1_of_loc_method/,False,,,6,1556439219,,1,,True,False,False,curlyhair,t5_2t79l,193572,public,default,,,Day 1 of LOC method,https://i.redd.it/xu2t977dryu21.jpg,all_ads,6,False,t2_353ls913,,,{},True,False,,1556525587.0,[],0.0,,,,,,,,
26,Justapotato8,,[],,text,False,False,1556439824,i.redd.it,https://www.reddit.com/r/curlyhair/comments/bi95k8/day_1_loc_method/,,bi95k8,True,False,True,False,False,,,[],,,dark,text,False,False,True,10,0,False,all_ads,/r/curlyhair/comments/bi95k8/day_1_loc_method/,False,,,6,1556439824,,25,,True,False,False,curlyhair,t5_2t79l,193574,public,default,,,Day 1 LOC method,https://i.redd.it/5r47pm56tyu21.jpg,all_ads,6,False,t2_353ls913,,,{},True,False,,1556526190.0,[],0.0,,,,,,,,
27,Micha112,,[],,text,False,False,1556484564,self.curlyhair,https://www.reddit.com/r/curlyhair/comments/bifvbo/day_1_loc_method/,,bifvbo,True,False,False,True,False,,,[],,,dark,text,False,False,True,2,0,False,all_ads,/r/curlyhair/comments/bifvbo/day_1_loc_method/,False,,,6,1556484565,,1,"My daughter used Devacurl LOC method first time today. It looks good and soft but there are pieces that seem clumped, liked stiff. Is this normal and does it go away over time?",True,False,False,curlyhair,t5_2t79l,193731,public,self,,,Day #1 LOC method,https://www.reddit.com/r/curlyhair/comments/bifvbo/day_1_loc_method/,all_ads,6,False,t2_3c3hqp1z,,,{},True,False,,1556570948.0,[],0.0,,,,,,,,
28,Regals13,,[],,text,False,False,1556729391,self.curlyhair,https://www.reddit.com/r/curlyhair/comments/bjjf9t/more_protein_more_moisture_what_should_i_do/,,bjjf9t,True,False,False,True,False,#fb7f72,one,[],762e5196-21dd-11e6-90ce-0ebfe7658481,help,light,text,False,False,True,9,0,False,all_ads,/r/curlyhair/comments/bjjf9t/more_protein_more_moisture_what_should_i_do/,False,,,6,1556729392,,1,"Hi there, 

&amp;#x200B;

I was hoping someone could help me and maybe give some tips. I'm growing out my hair, but I'm not really happy with how it is atm. 

As you can see in the pictures, my hair gets pretty frizzy. I don't even mind it as it is in the pictures, but it gets worse during the day. Most times it won't last until the evening. A 2nd hairday isn't even an option. My hair feels quite soft, and I think it's hydrated well enough. Maybe I should use a protein treatment? 

&amp;#x200B;

I'm pretty sure I've got high porosity hair, so I use a LOC + gel method. 

&amp;#x200B;

Routine: (all products CG approved) 

&amp;#x200B;

1. co-wash with local/cheap conditioner with coconut oil in it. 

I leave the tiniest bit in. 

&amp;#x200B;

2. Then I dry by gently pressing with a micro-fiber towel. Hair is too short to either plop or crunch... 

&amp;#x200B;

3. I then apply a tiny bit of olive oil, as I think my high-porosity hair benefits from it. 

&amp;#x200B;

4. Shea Moisture Coconut &amp; Hibiscus Curl Enhancing Smoothie. Just the tiniest amount and gently rub that in my hair in a backwards motion. 

&amp;#x200B;

5. Then I apply a light gel, the same as the fourth step. I use two finger tops. 

&amp;#x200B;

6. Air dry for minimally two hours and then scrunch out the crunch. 

&amp;#x200B;

I really, really hate the air drying part. It looks absolutely ridiculous  before I can scrunch out the crunch. That's why I don't like too much product. 

&amp;#x200B;

Thank's a lot in advance!!!

&amp;#x200B;

![img](6ggu2tnbomv21)

![img](8nq04qnbomv21)

![img](37zn0fnbomv21)

![img](0i3zbqnbomv21)",True,False,False,curlyhair,t5_2t79l,194456,public,self,,,"More protein, more moisture??? What should I do?",https://www.reddit.com/r/curlyhair/comments/bjjf9t/more_protein_more_moisture_what_should_i_do/,all_ads,6,False,t2_1atdc5dv,,,{},True,False,,1556815780.0,[],0.0,,,,,,,,
29,9819304,,[],,text,False,False,1557886461,self.curlyhair,https://www.reddit.com/r/curlyhair/comments/borzqb/short_hair_curly_when_not_using_products_loc/,,borzqb,True,False,False,True,False,,,[],,,dark,text,False,False,True,5,0,False,all_ads,/r/curlyhair/comments/borzqb/short_hair_curly_when_not_using_products_loc/,False,,,6,1557886464,,1,"I notice when I use LOC after a shower in the AM when my hair is wet and then comb it, it ""dries"" straight? But I don't want it to. I want it to curl up like it does naturally.

Its only about 3-4 inches on the top, and shaved on the sides, but if I don't put any product in, it's curly just dry and frizzy",True,False,False,curlyhair,t5_2t79l,197361,public,self,,,"Short hair, curly when not using products. LOC makes it straight?",https://www.reddit.com/r/curlyhair/comments/borzqb/short_hair_curly_when_not_using_products_loc/,all_ads,6,False,t2_39rbc8aq,,,{},True,False,,1557972845.0,[],0.0,,,,,,,,
30,NormieCuckIce,,[],,text,False,False,1557896785,self.curlyhair,https://www.reddit.com/r/curlyhair/comments/botmoj/how_to_i_m17_4c_hair_3_inches_keep_my_hair/,,botmoj,True,False,False,True,False,#fb7f72,one,[],762e5196-21dd-11e6-90ce-0ebfe7658481,help,light,text,False,False,True,1,0,False,all_ads,/r/curlyhair/comments/botmoj/how_to_i_m17_4c_hair_3_inches_keep_my_hair/,False,,,6,1557896787,,3,"ive been searching for this answer but cant find it. how to I moisturize my  hair in the morning and keep it moisturized throughout the day? what products should i use? i currently only have shea moisture red palm oil and cocoa butter curl strength putting with flaxeed oil. sulfate free, color safe. ive seen some LOC method but idk what that is or if i should do it. any suggestions?",True,False,False,curlyhair,t5_2t79l,197419,public,self,,,"How to I (M/17 4c hair 3 inches) keep my hair moisturized when I am not washing that day? or in the morning. also, how do i retain moisture throughout the day?",https://www.reddit.com/r/curlyhair/comments/botmoj/how_to_i_m17_4c_hair_3_inches_keep_my_hair/,all_ads,6,False,t2_y6fx6dp,,,{},True,False,,1557983160.0,[],0.0,,,,,,,,
