,author,author_flair_css_class,author_flair_richtext,author_flair_text,author_flair_type,can_mod_post,contest_mode,created_utc,domain,full_link,gilded,id,is_crosspostable,is_original_content,is_reddit_media_domain,is_self,is_video,link_flair_background_color,link_flair_css_class,link_flair_richtext,link_flair_template_id,link_flair_text,link_flair_text_color,link_flair_type,locked,media_only,no_follow,num_comments,num_crossposts,over_18,parent_whitelist_status,permalink,pinned,post_hint,preview,pwls,retrieved_on,rte_mode,score,selftext,send_replies,spoiler,stickied,subreddit,subreddit_id,subreddit_subscribers,subreddit_type,thumbnail,thumbnail_height,thumbnail_width,title,url,whitelist_status,wls,is_meta,author_fullname,author_flair_background_color,author_flair_text_color,gildings,is_robot_indexable,author_patreon_flair,author_flair_template_id,updated_utc,all_awardings,total_awards_received,allow_live_comments,steward_reports,awarders,og_description,og_title,author_premium,treatment_tags,upvote_ratio
0,thesimranvenkat,,[],,text,False,False,1530883295,i.redd.it,https://www.reddit.com/r/curlyhair/comments/8wk0nq/have_always_lived_with_wavy_straight_hair_welcome/,0.0,8wk0nq,True,False,True,False,False,#373c3f,eight,"[{'e': 'text', 't': 'curl type'}]",b6e06d50-21dd-11e6-a2cb-0e44af8cb2cb,curl type,light,richtext,False,False,True,6,0,False,all_ads,/r/curlyhair/comments/8wk0nq/have_always_lived_with_wavy_straight_hair_welcome/,False,image,"{'enabled': True, 'images': [{'id': 'z2imKqPROMEQYzGWOmJHVC9j9oWqE5P4qqwMFjIAjtQ', 'resolutions': [{'height': 108, 'url': 'https://i.redditmedia.com/2T9HPx3Tbgp9b5oLJuK7JxAWq-x_vlCx1EwzDMwEv6g.jpg?fit=crop&amp;crop=faces%2Centropy&amp;arh=2&amp;w=108&amp;s=6ef2b6f88088f6e42353d5a8b9eb436b', 'width': 108}, {'height': 216, 'url': 'https://i.redditmedia.com/2T9HPx3Tbgp9b5oLJuK7JxAWq-x_vlCx1EwzDMwEv6g.jpg?fit=crop&amp;crop=faces%2Centropy&amp;arh=2&amp;w=216&amp;s=19d51208bd97926215c45392be20ec97', 'width': 216}, {'height': 320, 'url': 'https://i.redditmedia.com/2T9HPx3Tbgp9b5oLJuK7JxAWq-x_vlCx1EwzDMwEv6g.jpg?fit=crop&amp;crop=faces%2Centropy&amp;arh=2&amp;w=320&amp;s=57206d2239b5237ce907ba6536d31509', 'width': 320}, {'height': 640, 'url': 'https://i.redditmedia.com/2T9HPx3Tbgp9b5oLJuK7JxAWq-x_vlCx1EwzDMwEv6g.jpg?fit=crop&amp;crop=faces%2Centropy&amp;arh=2&amp;w=640&amp;s=62c10ee767cd923eefca11bd46bee2ee', 'width': 640}, {'height': 960, 'url': 'https://i.redditmedia.com/2T9HPx3Tbgp9b5oLJuK7JxAWq-x_vlCx1EwzDMwEv6g.jpg?fit=crop&amp;crop=faces%2Centropy&amp;arh=2&amp;w=960&amp;s=33ed006327fd9105ace5df49ff1944f4', 'width': 960}, {'height': 1080, 'url': 'https://i.redditmedia.com/2T9HPx3Tbgp9b5oLJuK7JxAWq-x_vlCx1EwzDMwEv6g.jpg?fit=crop&amp;crop=faces%2Centropy&amp;arh=2&amp;w=1080&amp;s=ca775f056d0e517a4794fc1a7a898267', 'width': 1080}], 'source': {'height': 1280, 'url': 'https://i.redditmedia.com/2T9HPx3Tbgp9b5oLJuK7JxAWq-x_vlCx1EwzDMwEv6g.jpg?s=7da1893dc97e56c0bb186df2ba0c93ef', 'width': 1280}, 'variants': {}}]}",6,1530883296,markdown,5,,True,False,False,curlyhair,t5_2t79l,106156,public,https://b.thumbs.redditmedia.com/M1fLX3sCNnEkNRfMG9REKCKMKAO6Rtx12gN3sF_VwqU.jpg,140.0,140.0,Have always lived with wavy/ straight hair. Welcome me to a new community :) it's a struggle. I've tried LOC so far for my 2c hair. Tips?,https://i.redd.it/fnuoekuhwb811.jpg,all_ads,6,,,,,,,,,,,,,,,,,,,
1,Persephonal,,[],,text,False,False,1532457644,self.curlyhair,https://www.reddit.com/r/curlyhair/comments/91k3vt/new_to_cgm_need_your_expert_opinions_in/,0.0,91k3vt,True,False,False,True,False,,eight,"[{'e': 'text', 't': 'curl type'}]",,curl type,dark,richtext,False,False,True,5,0,False,all_ads,/r/curlyhair/comments/91k3vt/new_to_cgm_need_your_expert_opinions_in/,False,,,6,1532457646,markdown,5,"Hello all! I'm very new to CGM and seems to be helping already in the first week of doing it. 

[A few pictures](https://imgur.com/a/QRoOF1q)

For some details, my hair is color-treated. I do low-poo every time I wash my hair, but I use twice as much conditioner each time. I just need to start using my detangling comb in the shower as opposed to right after when I apply detangler and oil. I also just started plopping with a cotton t-shirt, but I can't figure out how to pineapple my hair at this length. Other than that, I just need a bit of guidance on a few things:

1. What type of curl am I working with? I'm thinking I'm a 2B, but not entirely sure.

2. Should I be using a mousse or a gel? My biggest struggle right now is my hair losing curl shape, especially after the first day (I usually wash my hair every 2-3 days). I would love more hold of curl definition and volume if possible, but since my hair is so long I feel like I should avoid products that are too heavy. Thoughts?

3. Does my product list seem good? I use the LOC method. Here's the list in order of use:

- For **shampoo**, I've been alternating between [Carol's Daughter Sacred Tiare](https://www.carolsdaughter.com/sacred-tiare-sulfate-free-shampoo/820645226203.html?cgid=hair-collection-sacred-tiare), [Carol's Daughter Black Vanilla](https://www.carolsdaughter.com/black-vanilla-moisture-shine-sulfate-free-shampoo/820645226067.html?cgid=hair-collection-black-vanilla), or [Shea Moisture Peace Rose Oil Complex](https://www.sheamoisture.com/peace-rose-oil-complex-nourish-silken-shampoo.html?gdffi=8b472ad5fa4e4ed0ba0fc37b196c73c8&amp;gdfms=43AC16A6C581435C811AC256C132DBFC).

- For **conditioner**, same as above. [Sacred Tiare ingredients](https://www.carolsdaughter.com/sacred-tiare-fortifying-conditioner/820645226166.html?cgid=hair-collection-sacred-tiare), [Black Vanilla](https://www.carolsdaughter.com/black-vanilla-moisture-shine-hydrating-conditioner/820645226036.html?cgid=hair-collection-black-vanilla), [Peace Rose Oil Complex](https://www.sheamoisture.com/peace-rose-oil-complex-nourish-silken-conditioner-764302216315.html?gdffi=8b472ad5fa4e4ed0ba0fc37b196c73c8&amp;gdfms=96DBD02A0B894333963A55EDDB70BE2B).

- For **detangler** I use Sixteen92 Detangling Mists *(ingredients: Purified water,  aloe vera gel, vegetable glycerin, mallow root extract, polysorbate 20, fragrance blend, liquid germall+ (preservative), vitamin e)*

- For **leave-in conditioner**, I use [Carol's Daughter Sacred Tiare](https://www.carolsdaughter.com/sacred-tiare-leave-in-conditioner/820645226173.html?cgid=hair-collection-sacred-tiare) or [Black Vanilla](https://www.carolsdaughter.com/black-vanilla-moisture-shine-leave-in-conditioner/820645226043.html?cgid=hair-collection-black-vanilla#sz=999&amp;viewall=1&amp;start=3&amp;cgid=hair-collection-black-vanilla) leave-in conditioner, or [Shea Moisture Peace Rose Oil Complex](https://www.sheamoisture.com/peace-rose-oil-complex-nourish-silken-leave-in-treatment.html?gdffi=8b472ad5fa4e4ed0ba0fc37b196c73c8&amp;gdfms=C884D6BB4F7D4021ADB6624B53C0B031) or [100% Virgin Coconut Oil](https://www.sheamoisture.com/100-virgin-coconut-oil-leave-in-treatment.html?gdffi=8b472ad5fa4e4ed0ba0fc37b196c73c8&amp;gdfms=1234277778424AFB94872A148021CC62) leave-in treatments.

- For **hair oil**, I use Sixteen92 Supernatural Hair Serum *(ingredients:Argania Spinosa (Argan) Oil, Persea Gratissima (Avocado) Oil, Camellia Oleifera (Camellia) Seed Oil, Limnanthes alba (Meadowfoam) Oil, Simmondsia Chinensis (Jojoba) Seed Oil, Vitamin E, Fragrance Blend, Leucidal (preservative))*

- For **texturizer**, I use Sixteen92 Sea Salt Hair Mists *(ingredients:Purified water, aloe vera gel, dead sea salt, coconut oil, epsom salt, mallow root extract, polysorbate 20, fragrance blend, liquid germall+ (preservative))*

- For cream, I just started using this and I've been trying out [Miss Jessie's Pillow Soft Curls](http://missjessies.com/Pillow-Soft-Curls_2). Not sure if this is CGM friendly or not, and if I should use this in addition to a mousse/gel or not.

- When I do a deep conditioning treatment (once every week or two), I've been trying out either [Shea Moisture Jamaican Black Castor Oil Strengthen &amp; Restore Treatment Masque](https://www.sheamoisture.com/jamaican-black-castor-oil-strengthen-restore-treatment-masque-jbco.html) or [Raw Shea Butter Moisture Recovery Treatment Masque](https://www.sheamoisture.com/raw-shea-butter-deep-treatment-masque.html)

Woo, that was a mouthful. Anyway, thanks for bearing with me - any tips you can offer would be great!",True,False,False,curlyhair,t5_2t79l,110222,public,self,,,"New to CGM, need your expert opinions in determining wave/curl type, whether to use mousse or gel, and if my current product line-up is CGM friendly. Any other tips would be greatly appreciated too! Pictures and product list inside.",https://www.reddit.com/r/curlyhair/comments/91k3vt/new_to_cgm_need_your_expert_opinions_in/,all_ads,6,,,,,,,,,,,,,,,,,,,
2,curlzruleboysdrool,,[],,text,False,False,1533044929,self.curlyhair,https://www.reddit.com/r/curlyhair/comments/93emm1/shout_out_the_curlies_in_high_humidity_areas_yall/,0.0,93emm1,True,False,False,True,False,,,[],,,dark,text,False,False,True,11,0,False,all_ads,/r/curlyhair/comments/93emm1/shout_out_the_curlies_in_high_humidity_areas_yall/,False,,,6,1533044930,markdown,25,"From a low to mild humidity area (Southern California). I have travelled to New England for a wedding this week &amp; the struggle is real! In Boston, my hair was a disaster, even though I thought I had used enough product. Now down in Rhode Island, and I co-washed and changed up the routine a bit, so there’s improvement, but still. So. Much. Frizz. LOC method followed by all the gel in the world ain’t cutting it.",True,False,False,curlyhair,t5_2t79l,111929,public,self,,,Shout out the curlies in high humidity areas. Y’all are the real warriors!,https://www.reddit.com/r/curlyhair/comments/93emm1/shout_out_the_curlies_in_high_humidity_areas_yall/,all_ads,6,False,,,,,,,,,,,,,,,,,,
3,B1gg-E,,[],,text,False,False,1534213933,self.curlyhair,https://www.reddit.com/r/curlyhair/comments/974m6z/oil_quality/,0.0,974m6z,True,False,False,True,False,,,[],,,dark,text,False,False,True,2,0,False,all_ads,/r/curlyhair/comments/974m6z/oil_quality/,False,,,6,1534213934,,1,"I've recently started following the LOC technique for styling my hair (within the CG method), and I've been really liking it so far. My usual routine is to condition with Maui Curly, rinse most of it out, scrunch with a floursack towel, coat with jojoba oil, and either scrunching with Shea Moisture curl milk or enhancing smoothie, depending on the day.

I've been reading up on different sites, in particular Manly Curls, and he recommends for Type 3 to coat lightly with a high quality virgin olive oil.

I'm wondering if the quality of the oil matters for use in hair, or if the stuff I get off the shelf at my local supermarket would work just as well?",True,False,False,curlyhair,t5_2t79l,115285,public,self,,,Oil Quality,https://www.reddit.com/r/curlyhair/comments/974m6z/oil_quality/,all_ads,6,False,,,,,,,,,,,,,,,,,,
4,Aphander,,[],,text,False,False,1535246552,self.curlyhair,https://www.reddit.com/r/curlyhair/comments/9abwp1/what_routine/,0.0,9abwp1,True,False,False,True,False,,,[],,,dark,text,False,False,True,2,0,False,all_ads,/r/curlyhair/comments/9abwp1/what_routine/,False,,,6,1535246553,,1," I haven't started with the CG YET but i'm trying to get the right products for my hair(3A, high density, medium perosity, thick hair)  so please give your opinion or share your experience over my ""FUTURE"" routine 

Showering and co-wash hair with TRESemme botanique nourish and replenish conditioner or TRESemme perfectly (un)done conditioner  then S2C and rinse with cold water and LOC with Shea Moisture Coconut &amp; Hibiscus Curl &amp; Style Milk or SM Curl &amp; Shine Conditioner(I don't know which one), coconut oil , SM Coconut &amp; Hibiscus Curl Enhancing Smoothie. And Plob.",True,False,False,curlyhair,t5_2t79l,117270,public,self,,,What routine?,https://www.reddit.com/r/curlyhair/comments/9abwp1/what_routine/,all_ads,6,False,,,,,,,,,,,,,,,,,,
5,MissionEdge,,[],,text,False,False,1535853356,self.curlyhair,https://www.reddit.com/r/curlyhair/comments/9c8l46/what_is_my_hair_type_is_it_3cish/,0.0,9c8l46,True,False,False,True,False,#fb7f72,one,[],762e5196-21dd-11e6-90ce-0ebfe7658481,help,light,text,False,False,True,1,0,False,all_ads,/r/curlyhair/comments/9c8l46/what_is_my_hair_type_is_it_3cish/,False,,,6,1535853357,,2,"Hi, I've always wondered what my hair type was. I use the LOC method, shampoo my hair once a week, and condition almost everyday. My typical routine is I put conditioner in my hair and leave it in for about 3 minutes, I rinse it out with cold water, I apply leave in conditioner to my hair while it is still wet, then I run olive oil through my hair, and finish off with the Shea Moisture Curl enhancing Smoothie with the Argan Oil Eco Styler Gel. However, when I use this method my hair is very defined for about the first hour or two, but then it starts frizzing up. But, whenever I run my fingers through my hair for a while, my hair turns out like this. This is really confusing to me, because I have never seen anything like this before. I'm also Ethiopian if that helps in anyway. I would appreciate it if I could get some help, thanks.

https://i.redd.it/g3mpx5zweqj11.jpg",True,False,False,curlyhair,t5_2t79l,118946,public,self,,,What is my hair type? Is it 3Cish?,https://www.reddit.com/r/curlyhair/comments/9c8l46/what_is_my_hair_type_is_it_3cish/,all_ads,6,False,t2_shntkc1,,,,,,,,,,,,,,,,,
6,gnikzilgnikzil,pink,[],"3b, medium, brown, thick",text,False,False,1539190496,self.curlyhair,https://www.reddit.com/r/curlyhair/comments/9n18fa/taking_a_carryon_to_copenhagen_help/,,9n18fa,True,False,False,True,False,#fb7f72,one,[],762e5196-21dd-11e6-90ce-0ebfe7658481,help,light,text,False,False,True,7,0,False,all_ads,/r/curlyhair/comments/9n18fa/taking_a_carryon_to_copenhagen_help/,False,,,6,1539190497,,1,"I’m based in the Southern US and have type 3a/b curls. I use shampoo and conditioner without parabens, sulfates, etc. I use the LOC method (leave in, oil, cream). 

My husband booked us a ten day trip to Copenhagen and recently told me I can only pack a carry on..... 

Can anyone in Denmark or surrounding areas help me out in finding stores and affordable hair care products while I’m there? 

Thanks!",True,False,False,curlyhair,t5_2t79l,127602,public,self,,,Taking a carry-on to Copenhagen- help!,https://www.reddit.com/r/curlyhair/comments/9n18fa/taking_a_carryon_to_copenhagen_help/,all_ads,6,False,t2_gxoif,,dark,"{'gid_1': 0, 'gid_2': 0, 'gid_3': 0}",True,,,,,,,,,,,,,
7,jalebi25,,[],,text,False,False,1540663720,self.curlyhair,https://www.reddit.com/r/curlyhair/comments/9rwdni/loc_method/,,9rwdni,True,False,False,True,False,,,[],,,dark,text,False,False,True,4,0,False,all_ads,/r/curlyhair/comments/9rwdni/loc_method/,False,,,6,1540663722,,1,"Hey fellow curlies! I’m fairly new at the curly girl method and was wondering if anyone had tried the LOC method for their hair, and if so what were the results? ",True,False,False,curlyhair,t5_2t79l,131455,public,self,,,LOC method,https://www.reddit.com/r/curlyhair/comments/9rwdni/loc_method/,all_ads,6,False,t2_263s6y49,,,"{'gid_1': 0, 'gid_2': 0, 'gid_3': 0}",True,False,,,,,,,,,,,,
8,mayaerin1,,[],,text,False,False,1542700711,self.curlyhair,https://www.reddit.com/r/curlyhair/comments/9yq4gu/order_of_products/,,9yq4gu,True,False,False,True,False,,,[],,,dark,text,False,False,True,5,0,False,all_ads,/r/curlyhair/comments/9yq4gu/order_of_products/,False,,,6,1542700712,,1,"I've been Googling the correct order of products as a CG method newbie for what feels like approximately 8 years without a definite answer. LOC method isn't really applicable due to my weirdly oily fine-haired jewfro. I've had more success with mousse than gel but I've seen some people use both? What order would I apply products, and which ones do you apply soaking wet (right out of/in the shower) vs. damp (after the initial towel wrapping)?

I have been using with limited success:
Not your Mother's 3-1 Conditioner as Leave-in,
followed by their Curl defining creme, and then the curl activating mousse when mostly dry.
Plump for Joy spray to SOTC.

I also have LA Sport Gel but am pitifully awful at application and have avoided it because of that. This subreddit seems to really like gel and I'm wondering if I'm just doing it wrong?

Any advice appreciated!

",True,False,False,curlyhair,t5_2t79l,138081,public,self,,,Order of Products?,https://www.reddit.com/r/curlyhair/comments/9yq4gu/order_of_products/,all_ads,6,False,t2_1v8d5fet,,,"{'gid_1': 0, 'gid_2': 0, 'gid_3': 0}",True,False,,,,,,,,,,,,
9,fitfreakgeek,,[],,text,False,False,1542808959,self.curlyhair,https://www.reddit.com/r/curlyhair/comments/9z3gkq/hair_constantly_tangled_dry_and_falling_out_using/,,9z3gkq,True,False,False,True,False,#fb7f72,one,[],762e5196-21dd-11e6-90ce-0ebfe7658481,help,light,text,False,False,True,6,0,False,all_ads,/r/curlyhair/comments/9z3gkq/hair_constantly_tangled_dry_and_falling_out_using/,False,,,6,1542808959,,1,"hey friends!

&amp;#x200B;

i've been using the CG method for most of this year to try to define my 2B/2C curls. when i started, i was using silicone and sulfate-free shampoo/conditioner (kiehl's colour-preserving sunflower oil) 2-3 times per week and following up with the LOC method (unfortunately i don't remember the products i used for that, except the oil was also from kiehl's) and plopping with a thin t-shirt.  i found it pretty good, my hair felt softer and my curls were slightly more defined. i eventually switched to shea moisture coconut &amp; hibiscus curl &amp; shine shampoo/conditioner 2 x per week due to the price of the kiehl's stuff, following up with an oil (loreal elvive extraordinary oil) and a gel (devacurl ultra-defining), + plopping. i found this gave me much more definition but nothing i tried gave me the volume i wanted and i had a sort of weird curl pattern at the roots, so i dropped the gel and have let my curls be a bit more relaxed lately. throughout this whole time i've only used heat extremely rarely, always plopping then air-drying, and never brushed my hair unless in the shower and covered in conditioner (lots), with a wide-tooth comb.

&amp;#x200B;

however, for the second half of this year - i'm pretty sure it started while still using the old kiehl's products - my hair is constantly tangled and always falling out. even directly after coming out of the shower, which i finish with detangling, my hair straight away feels tangled and dry. i'm leaving hair all over the place and when i detangle there is so much more coming out than ever used to. this has resulted in my hair now being much, much thinner than it's ever been before and i hate it. nothing has changed in my life - if anything i'm less stressed - and no new medications, climates or anything. i'm going to the hairdresser mid-december and probably going to just cut it off (mid-back to shoulders) because it's stressing me out and upsetting me! but i'll also ask her for advice.

&amp;#x200B;

i was just wondering if anyone here has experienced this or knows of anything that could be causing it? i want my hair back! thank you in advance for any help you can offer.

&amp;#x200B;

&amp;#x200B;",True,False,False,curlyhair,t5_2t79l,138316,public,self,,,"hair constantly tangled, dry and falling out using CG method",https://www.reddit.com/r/curlyhair/comments/9z3gkq/hair_constantly_tangled_dry_and_falling_out_using/,all_ads,6,False,t2_e5pzn,,,"{'gid_1': 0, 'gid_2': 0, 'gid_3': 0}",True,False,,,,,,,,,,,,
10,ccsunflowr,,[],,text,False,False,1543519712,self.curlyhair,https://www.reddit.com/r/curlyhair/comments/a1khrg/what_shampoo_to_take_out_oil_treatments/,,a1khrg,True,False,False,True,False,#fb7f72,one,[],762e5196-21dd-11e6-90ce-0ebfe7658481,help,light,text,False,False,True,5,0,False,all_ads,/r/curlyhair/comments/a1khrg/what_shampoo_to_take_out_oil_treatments/,False,,,6,1543519712,,1,"So: sorry for all my questions- but even one answered can be helpful!

&amp;#x200B;

I am majorly missing a deep-condition part of my regimen and trying to add it. Do you guys have any drugstore recs for a deep condition/treatment part? I was just thinking of starting to do olive or argan oil, but did read in wiki that you need to shampoo to get all oil out. Do you need to do a shampoo after using a deep conditioner, or just oils? 

&amp;#x200B;

I still have my Suave clarifying from when I first began CG method- can I just use that? Or would it defeat purpose of deep treatment! I also am using it maybe once a month to strip buildup, is this ruining Cg method for me? Maybe just use a CG approved shampoo JUST for buildup and oil removal?

&amp;#x200B;

&amp;#x200B;

&amp;#x200B;

Sorry- can't seem to find these answers in the thorough wiki (: 

&amp;#x200B;

current regimen:

CO-wash with Tresseme Botanical conditioner

Cantu twist n loc for scrunching in - (1st styling product- is too heavy, going to try curl-activator next)

Air dry /sometimes twist hair into bun later let it out

water scrunch for next day hair

&amp;#x200B;

&amp;#x200B;

(also- recently died hair back to blonde back from black box dye Mia Wallace costume, and it's DRY DRY DRY. but still  THIC as ever and not close to falling out at least!)",True,False,False,curlyhair,t5_2t79l,142785,public,self,,,What shampoo to take out oil treatments?,https://www.reddit.com/r/curlyhair/comments/a1khrg/what_shampoo_to_take_out_oil_treatments/,all_ads,6,False,t2_yttjh7,,,"{'gid_1': 0, 'gid_2': 0, 'gid_3': 0}",True,False,,,,,,,,,,,,
11,jadeblue01,,[],,text,False,False,1543822578,self.curlyhair,https://www.reddit.com/r/curlyhair/comments/a2mh2e/what_creams_and_oils_are_good_for_lopo_hair_and/,,a2mh2e,True,False,False,True,False,,,[],,,dark,text,False,False,True,1,0,False,all_ads,/r/curlyhair/comments/a2mh2e/what_creams_and_oils_are_good_for_lopo_hair_and/,False,,,6,1543822579,,1,,True,False,False,curlyhair,t5_2t79l,144020,public,self,,,What creams and oils are good for lo-po hair? And what’s the loc method?,https://www.reddit.com/r/curlyhair/comments/a2mh2e/what_creams_and_oils_are_good_for_lopo_hair_and/,all_ads,6,False,t2_2l1e2e7a,,,"{'gid_1': 0, 'gid_2': 0, 'gid_3': 0}",True,False,,,,,,,,,,,,
12,Trackgirl123,purple,[],"3B/3C, past shoulders, dark brown, thicc AF",text,False,False,1544159844,i.redd.it,https://www.reddit.com/r/curlyhair/comments/a3wrro/cmon_curls_lets_get_sickening_loc_method_is_where/,,a3wrro,True,False,True,False,False,,,[],,,dark,text,False,False,True,3,0,False,all_ads,/r/curlyhair/comments/a3wrro/cmon_curls_lets_get_sickening_loc_method_is_where/,False,,,6,1544159845,,1,,True,False,False,curlyhair,t5_2t79l,144974,public,default,,,"C'MON curls, lets get sickening. LOC Method is where its at.",https://i.redd.it/d91z9evhis221.jpg,all_ads,6,False,t2_cvxyhju,#795acc,light,"{'gid_1': 0, 'gid_2': 0, 'gid_3': 0}",True,False,5ed5ab46-58ab-11e3-81d9-12313b04ceaf,,,,,,,,,,,
13,B1gg-E,,[],,text,False,False,1545769863,self.curlyhair,https://www.reddit.com/r/curlyhair/comments/a9i1ie/how_often_and_when_to_trim_ends/,,a9i1ie,True,False,False,True,False,,one,[],,help,dark,text,False,False,True,1,0,False,all_ads,/r/curlyhair/comments/a9i1ie/how_often_and_when_to_trim_ends/,False,,,6,1545769864,,1,"2c - 3c curls, CG for about a year. 
Routine: 
Rinse just about every day, condition with Shea Moisture marshmallow, rinse cold water, squish during rinse, gel or LOC method, plop for as long as it takes me to shave.

I love the results and how I'm finally learning how to take care of my hair properly, but some tendrils just don't want to settle down, and I wonder if it might be because they need a trim.

I want to grow my hair as long as I can, so I'm pretty apprehensive to cut anything, especially if it means going to a barber since none I've ever been to know the first thing about cutting curly hair. I'm willing to buy my own hair shears and giving myself a dusting, but I was curious if there was any rules to the process I should be following?",True,False,False,curlyhair,t5_2t79l,149314,public,self,,,How often and when to trim ends?,https://www.reddit.com/r/curlyhair/comments/a9i1ie/how_often_and_when_to_trim_ends/,all_ads,6,False,t2_n609r,,,"{'gid_1': 0, 'gid_2': 0, 'gid_3': 0}",True,False,,,,,,,,,,,,
