58,the-one217,,[],,text,False,False,1578864783,self.curlyhair,https://www.reddit.com/r/curlyhair/comments/entuex/ideas_for_managing_hair_and_split_custody/,,entuex,True,False,False,True,False,,,[],,,dark,text,False,False,True,2,0,False,all_ads,/r/curlyhair/comments/entuex/ideas_for_managing_hair_and_split_custody/,False,,,6,1578864784,,1,"My stepdaughter (10 years old) is biracial and has thick curly hair (3c). Her hair is beautiful but prior to me being in her life, neither my husband or her mother spent any time doing her hair. It was always in a frizzy ponytail and they had no products/methods for her. 

Once we were living together I spent time on this sub and figured out the LOC method works for her and bought products for our house and her moms house. 

However she never does it/mom never does it at their house. It’s the frizzy ponytail with no moisture. The problem is she is with us off and on through the week. We have her weds, fri, sat and every other tues. 

Bc mom doesn’t do the routine, she is a knotted mess when we get her and then it’s very hard to comb her hair and it hurts so she doesn’t want to do it... and the cycle continues 

Idk what to do. Should I stop caring? She needs help, but her mom doesn’t seem interested in helping her. I know if a few years she will be more able to do it herself.

Also we did get a haircut that’s a little bit shorter so help but that didn’t encourage mom either :(",True,False,False,curlyhair,t5_2t79l,303771,public,self,,,Ideas for managing hair and split custody?,https://www.reddit.com/r/curlyhair/comments/entuex/ideas_for_managing_hair_and_split_custody/,all_ads,6,False,t2_1xzi0win,,,{},True,False,,,[],0.0,False,[],[],,,False,,
59,Shineloutre,,[],,text,False,False,1580674454,self.curlyhair,https://www.reddit.com/r/curlyhair/comments/exudv3/help_hair_routine_for_mixed_hair/,,exudv3,True,False,False,True,False,#fb7f72,one,[],762e5196-21dd-11e6-90ce-0ebfe7658481,help,light,text,False,False,True,1,0,False,all_ads,/r/curlyhair/comments/exudv3/help_hair_routine_for_mixed_hair/,False,,,6,1580674455,,1,"Hello there :)
It's my first time using reddit, hope i'm doing it right ^_^

So... I'm struggling a lot with my hair, and i need some help, YOUR help amazing gorgeous curly People !

I am half french, half malagasy, and my hair are Also mixed, from what i see, i have 3 types of different texture on my head

On the front and the side, my hair are type 3c, tight fine curly hair, quite high porosity
On the bottom back i have thick wavy hair perfect shine, super healthy, normal porosity (why my head ain't like this everywhere :()
Annnd on the top back, i have super puffy hair, really dry, hard to define , high porosity

The thing is, i don't know how to tame this mess
I've started the LOC methode 8 months ago

Starting with the mixed chicks gently cleanse shampoo (with those silicon massage brush) 

Next a mask (if i do one) lately it's the shea moisture strenghen and restore treatment mask or the 10-1 multi benefit mask, with a heat cap for like an hour usually

After that, i put some conditionner, in the begining it was the pink paradise conditionner from les secrets de loly (a french brand) but i changed because i wasn't convinced by it, so now i'm trying the boucleme conditionner, but i'm not super fan too, i don't know, it doesn't seem enough to nourrish my mess, i always wash all of it because i have super thin hair, and i lack of volume and like the next step already put enough weigh on my head

Then i start the Loc without drying my hair at all

For the L i was using the Milk hair smoothie from les secrets de loly, but even if my hair was rly soft, it turns it quite oily and it feels like too much for my fine hair, now i'm using the boucleme curl cream as a leave-in, but my hair is so oily with this :( (yet the texture seems lighter and i have slightly more volume)

Then i'm finger coiling or using the denman brush

Scrunching with the mane serum oil mist

And i end this with applying gel, before it was the kinky curly curling custard, it worked but i wanted to try something else, so now i'm using the boucleme curl défining gel, and i like it yes

And leave it dries naturally

The thing is, i do believe i should use different product because the result is so différent between the front and the back, like it's hard to keep définition on my back (i'm doing pinneaple with satin bonnet) 
Plus my hair seems always so oily x(
Also i lack of volume so muuch, i don't know what to do
I'm afraid that the product for fine hair won't nourrish my hair enough but Maybe i should try it ?

How to ameliorate my hair routine ? :(

Thanks y'all in avance :) 

(sorry for the english mistakes !)",True,False,False,curlyhair,t5_2t79l,315091,public,self,,,Help hair routine for mixed hair,https://www.reddit.com/r/curlyhair/comments/exudv3/help_hair_routine_for_mixed_hair/,all_ads,6,False,t2_5l2vkyap,,,{},True,False,,,[],0.0,False,,[],,,False,,
60,radiatelight67,,[],,text,False,False,1581607798,self.curlyhair,https://www.reddit.com/r/curlyhair/comments/f3bm8e/has_anyone_tried_the_loc_method_for_more_moisture/,,f3bm8e,True,False,False,True,False,#0266b3,four,[],8a0f6380-21dd-11e6-9e78-0ead3f7791ed,discussion,light,text,False,False,True,1,0,False,all_ads,/r/curlyhair/comments/f3bm8e/has_anyone_tried_the_loc_method_for_more_moisture/,False,,,6,1581607805,,1,"I recently read about this method of applying styling products. First you put leave in on, then oil, and then cream. I'm going to try it for my next wash day but I'm curious if others have had good results.",True,False,False,curlyhair,t5_2t79l,324516,public,self,,,Has anyone tried the LOC method for more moisture?,https://www.reddit.com/r/curlyhair/comments/f3bm8e/has_anyone_tried_the_loc_method_for_more_moisture/,all_ads,6,False,t2_3dgx5sly,,,{},True,False,,,[],0.0,False,,[],,,False,,
61,Taijem,,[],,text,False,False,1583255989,self.curlyhair,https://www.reddit.com/r/curlyhair/comments/fcxw0h/hair_health_questions/,,fcxw0h,True,False,False,True,False,#fb7f72,one,[],762e5196-21dd-11e6-90ce-0ebfe7658481,help,light,text,False,False,True,2,0,False,all_ads,/r/curlyhair/comments/fcxw0h/hair_health_questions/,False,,,6,1583255995,,1,"for the last month Ive been using the LCO/LOC system plus the beginner routine and In happy with the results I get while using but I feel like its all a facade, I feel like its only making an illusion that my hair looks healthy but its really not? Essentially my question is that this the beginner routine/LCO system making my hair healthy or is it just defining my curls?",True,False,False,curlyhair,t5_2t79l,335943,public,self,,,Hair health questions,https://www.reddit.com/r/curlyhair/comments/fcxw0h/hair_health_questions/,all_ads,6,False,t2_om0ux,,,{},True,False,,,[],0.0,False,,[],,,False,,
62,Smhtimothy,,[],,text,False,False,1583685397,self.curlyhair,https://www.reddit.com/r/curlyhair/comments/ffezs4/some_advice_would_be_appreciated/,,ffezs4,True,False,False,True,False,#fb7f72,one,[],762e5196-21dd-11e6-90ce-0ebfe7658481,help,light,text,False,False,True,0,0,False,all_ads,/r/curlyhair/comments/ffezs4/some_advice_would_be_appreciated/,False,self,"{'enabled': False, 'images': [{'id': 'h2kUqnxLzcKRnSjFg_0vaT8_BKbq5Cg90OsumqvBB5A', 'resolutions': [{'height': 108, 'url': 'https://external-preview.redd.it/uRTP1fXiJsdml_tcz7uXAqV2xtwg4ShWHhWaZZ-BqX8.jpg?width=108&amp;crop=smart&amp;auto=webp&amp;s=c78d3c03cc2e28e24b9294c058936839d3bdf773', 'width': 108}, {'height': 216, 'url': 'https://external-preview.redd.it/uRTP1fXiJsdml_tcz7uXAqV2xtwg4ShWHhWaZZ-BqX8.jpg?width=216&amp;crop=smart&amp;auto=webp&amp;s=eeb8246b3e33d68c3c6ca7b123098fcce156c7b8', 'width': 216}, {'height': 320, 'url': 'https://external-preview.redd.it/uRTP1fXiJsdml_tcz7uXAqV2xtwg4ShWHhWaZZ-BqX8.jpg?width=320&amp;crop=smart&amp;auto=webp&amp;s=559f7adb89254166024df037275cb52905dcad70', 'width': 320}], 'source': {'height': 425, 'url': 'https://external-preview.redd.it/uRTP1fXiJsdml_tcz7uXAqV2xtwg4ShWHhWaZZ-BqX8.jpg?auto=webp&amp;s=8c9f80a021b0e980a35901420326c120b21d6444', 'width': 425}, 'variants': {}}]}",6,1583685398,,1,"I'm a 17 year old male and what I do is basically shampoo and condition my curly hair every Sunday and then i apply the LOC method which consists of (leave in conditioner, oil and cream).

Leave in conditioner: [https://imagesna.sslimagesamazon.com/images/I/711GNcDb6RL.\_SX425\_.jpg](https://images-na.ssl-images-amazon.com/images/I/711GNcDb6RL._SX425_.jpg)

Oil:  [https://cdn.shopify.com/s/files/1/0180/7041/products/sunflower\_47\_800x.jpg?v=1571262777](https://cdn.shopify.com/s/files/1/0180/7041/products/sunflower_47_800x.jpg?v=1571262777)

Moisturizer: [https://i5.walmartimages.com/asr/b0ecbd50-6ba8-458a-ab8c-8f299386559a\_1.11fa8fd8bc46065f7530fbe972b0b683.jpeg](https://i5.walmartimages.com/asr/b0ecbd50-6ba8-458a-ab8c-8f299386559a_1.11fa8fd8bc46065f7530fbe972b0b683.jpeg) 

On regular days of the week (Mon-Sat) i'll use the moisturizer alone but on Wednesdays i'll use the moisturizer and the leave in conditioner just to keep my hair moisturized during the week. One thing to note too is that I would moisturize my hair after the first shower and in the night i'll just wet my hair and that's all. I suffer from dandruff also because years ago I'd under moisturize my hair but recently i realized my dandruff isn't as bad as before since i started taking interest in my hair. Something else I realized is that at the crown of my head my hair is thinnest there and compared to the front and sides of my hair, the crown has the least amount of hair. I did an online thing on those sites to determine what porosity of hair I have but i've forgotten it but what i remember is that a question asked if i can see my scalp easily if I separated my hair a little and it was. I just need advice and need to know if I am doing the correct thing to my hair and if i need improvements or i need a new routine as it would greatly appreciated. Thank you for reading.",True,False,False,curlyhair,t5_2t79l,338232,public,self,,,Some advice would be appreciated,https://www.reddit.com/r/curlyhair/comments/ffezs4/some_advice_would_be_appreciated/,all_ads,6,False,t2_36a87nx6,,,{},True,False,,,[],0.0,False,,[],,,False,,
63,Smhtimothy,,[],,text,False,False,1583807560,self.curlyhair,https://www.reddit.com/r/curlyhair/comments/fg6s96/help/,,fg6s96,True,False,False,True,False,#fb7f72,one,[],762e5196-21dd-11e6-90ce-0ebfe7658481,help,light,text,False,False,True,1,0,False,all_ads,/r/curlyhair/comments/fg6s96/help/,False,self,"{'enabled': False, 'images': [{'id': 'h2kUqnxLzcKRnSjFg_0vaT8_BKbq5Cg90OsumqvBB5A', 'resolutions': [{'height': 108, 'url': 'https://external-preview.redd.it/uRTP1fXiJsdml_tcz7uXAqV2xtwg4ShWHhWaZZ-BqX8.jpg?width=108&amp;crop=smart&amp;auto=webp&amp;s=c78d3c03cc2e28e24b9294c058936839d3bdf773', 'width': 108}, {'height': 216, 'url': 'https://external-preview.redd.it/uRTP1fXiJsdml_tcz7uXAqV2xtwg4ShWHhWaZZ-BqX8.jpg?width=216&amp;crop=smart&amp;auto=webp&amp;s=eeb8246b3e33d68c3c6ca7b123098fcce156c7b8', 'width': 216}, {'height': 320, 'url': 'https://external-preview.redd.it/uRTP1fXiJsdml_tcz7uXAqV2xtwg4ShWHhWaZZ-BqX8.jpg?width=320&amp;crop=smart&amp;auto=webp&amp;s=559f7adb89254166024df037275cb52905dcad70', 'width': 320}], 'source': {'height': 425, 'url': 'https://external-preview.redd.it/uRTP1fXiJsdml_tcz7uXAqV2xtwg4ShWHhWaZZ-BqX8.jpg?auto=webp&amp;s=8c9f80a021b0e980a35901420326c120b21d6444', 'width': 425}, 'variants': {}}]}",6,1583807569,,1," I'm a 17-year-old male and what I do is basically shampoo and condition my curly hair every Sunday and then I apply the LOC method which consists of (leave-in conditioner, oil and cream).

Leave in conditioner: [https://imagesna.sslimagesamazon.com/images/I/711GNcDb6RL.\_SX425\_.jpg](https://images-na.ssl-images-amazon.com/images/I/711GNcDb6RL._SX425_.jpg)

Oil: [https://cdn.shopify.com/s/files/1/0180/7041/products/sunflower\_47\_800x.jpg?v=1571262777](https://cdn.shopify.com/s/files/1/0180/7041/products/sunflower_47_800x.jpg?v=1571262777)

Moisturizer: [https://i5.walmartimages.com/asr/b0ecbd50-6ba8-458a-ab8c-8f299386559a\_1.11fa8fd8bc46065f7530fbe972b0b683.jpeg](https://i5.walmartimages.com/asr/b0ecbd50-6ba8-458a-ab8c-8f299386559a_1.11fa8fd8bc46065f7530fbe972b0b683.jpeg)

On regular days of the week (Mon-Sat) I'll use the moisturizer alone but on Wednesdays, I'll use the moisturizer and the leave-in conditioner just to keep my hair moisturized during the week. One thing to note too is that I would moisturize my hair after the first shower and in the night I'll just wet my hair and that's all. I suffer from dandruff also because years ago I'd under moisturize my hair but recently I realized my dandruff isn't as bad as before since I started taking interest in my hair. Something else I realized is that at the crown of my head my hair is thinnest there and compared to the front and sides of my hair, the crown has the least amount of hair. I did an online thing on those sites to determine what porosity of hair I have but I've forgotten it but what I remember is that a question asked if I can see my scalp easily if I separated my hair a little and it was. I just need advice and need to know if I am doing the correct thing to my hair and if I need improvements or I need a new routine as it would greatly be appreciated. Thank you for reading.",True,False,False,curlyhair,t5_2t79l,338957,public,self,,,Help!,https://www.reddit.com/r/curlyhair/comments/fg6s96/help/,all_ads,6,False,t2_36a87nx6,,,{},True,False,,,[],0.0,False,,[],,,False,,
64,who_angel,,[],,text,False,False,1584850073,self.curlyhair,https://www.reddit.com/r/curlyhair/comments/fmtoq1/would_jojoba_or_rosehip_oil_be_better_for_sealing/,,fmtoq1,True,False,False,True,False,#fb7f72,one,[],762e5196-21dd-11e6-90ce-0ebfe7658481,help,light,text,False,False,True,1,0,False,all_ads,/r/curlyhair/comments/fmtoq1/would_jojoba_or_rosehip_oil_be_better_for_sealing/,False,,,6,1584850074,,1,"hello! i'm looking for some advice for what oil to use for the loc/lco method. my hair is very fine but very dense, high porosity, virgin, and 3b. i just realized my hair is high porosity and it makes so much sense (gets matted easily, absorbs moisture but doesn't keep it, wash and gos only last 2 days at most, loves protein, tons of breakage with no slip ends) and i want to try sealing in moisture after styling/leave ins for healthier hair and longer lasting wash and gos. i like a fluffier, bigger look and don't mind some frizz or lack of definition, so i'd like a lighter sealant. i'm thinking of rosehip oil or jojoba oil since i already have it, but if you have other suggestions i'm open to it. i'm still working on my routine but i'll put this week's wash day in the comments. thank you all!",True,False,False,curlyhair,t5_2t79l,343651,public,self,,,would jojoba or rosehip oil be better for sealing my hair?,https://www.reddit.com/r/curlyhair/comments/fmtoq1/would_jojoba_or_rosehip_oil_be_better_for_sealing/,all_ads,6,False,t2_5unnjuxe,,,{},True,False,,,[],0.0,False,,[],,,False,,
65,macaronimadi,,[],,text,False,False,1585716524,self.curlyhair,https://www.reddit.com/r/curlyhair/comments/fssx0e/wash_day_routine_successfully_achieved_3c4a_curls/,,fssx0e,True,False,False,True,False,#942193,five,[],906a348a-21dd-11e6-be5a-0e888a520d23,hair victory,light,text,False,False,True,0,0,False,all_ads,/r/curlyhair/comments/fssx0e/wash_day_routine_successfully_achieved_3c4a_curls/,False,,,6,1585716526,,1,"Hey guys!!! 
I just FINALLY mastered my wash day routine for the best possible outcome. Since I’ve been quarantined, I’ve been experimenting with different hair routines.
I’m half black and half white, I have medium 3c/4a hair with high porosity. 

WASH 
I fill a spray bottle with apple cider vinegar and section my hair. 
I proceed to mix an Aztec clay mask with acv to the consistency of a milky yogurt, i section my hair, spray down the sections, and apply the mask. I let that sit for 15 min, rinse, then apply the Shea moisture Manuka and honey deep conditioner ! I left that in for 30-45, then rinsed with COOL WATER. 
I always do this once a week.

PRODUCT APPLICATION
After I’ve washed, I use the LOC method - I use the olaplex leave in conditioner, coconut oil, and the Shea moisture curl stretch cream. I apply the carols daughter honey mimosa pomade as a scalp moisturizer! I also use a steamer while I’m applying my product to open the cuticle and allow full penetration.

STYLING
Since we are quarantined right now, I’ve just been doing two strand twists and leaving them in for a week and just repeating the process every Tuesday. 

after my wash, pre product application, my hair was VISIBLY and PHYSICALLY softer! My hair accepted the product so well!!
Definitely a win today for me!!",True,False,False,curlyhair,t5_2t79l,348152,public,self,,,WASH DAY ROUTINE SUCCESSFULLY ACHIEVED!! 3c/4a curls high porosity,https://www.reddit.com/r/curlyhair/comments/fssx0e/wash_day_routine_successfully_achieved_3c4a_curls/,all_ads,6,False,t2_13le783x,,,{},True,False,,,[],0.0,False,,[],,,False,,
66,vintagepop,,[],,text,False,False,1585831711,i.redd.it,https://www.reddit.com/r/curlyhair/comments/ftlqvo/how_do_i_get_rid_of_frizz_this_is_my_hair_after_i/,,ftlqvo,True,False,True,False,False,#fb7f72,one,[],762e5196-21dd-11e6-90ce-0ebfe7658481,help,light,text,False,False,True,0,0,False,all_ads,/r/curlyhair/comments/ftlqvo/how_do_i_get_rid_of_frizz_this_is_my_hair_after_i/,False,image,"{'enabled': True, 'images': [{'id': 'un46XLliffio1OlbwJ3SEUvMvpPu15An5CUJDbFuRxI', 'resolutions': [{'height': 192, 'url': 'https://preview.redd.it/vfn4lqpcieq41.jpg?width=108&amp;crop=smart&amp;auto=webp&amp;s=68f838c3fbaba13903ae1816d582356a663234c8', 'width': 108}, {'height': 384, 'url': 'https://preview.redd.it/vfn4lqpcieq41.jpg?width=216&amp;crop=smart&amp;auto=webp&amp;s=e5a7302f9e1700a76fc6eca07ce9a3ea7ddfec88', 'width': 216}, {'height': 568, 'url': 'https://preview.redd.it/vfn4lqpcieq41.jpg?width=320&amp;crop=smart&amp;auto=webp&amp;s=dbd561c6a0f7b68ec964345bb0672bc0ed8ec270', 'width': 320}, {'height': 1137, 'url': 'https://preview.redd.it/vfn4lqpcieq41.jpg?width=640&amp;crop=smart&amp;auto=webp&amp;s=c7632eec056e7246468d62be68c368566b6801ce', 'width': 640}], 'source': {'height': 1472, 'url': 'https://preview.redd.it/vfn4lqpcieq41.jpg?auto=webp&amp;s=622f02ab8269ddb610cd5824a41dd11480da7d6a', 'width': 828}, 'variants': {}}]}",6,1585831713,,1,,True,False,False,curlyhair,t5_2t79l,348925,public,https://b.thumbs.redditmedia.com/Mdm9JsiZ-129A948CMEBZQyhFjE9GYzD4KPAk0T-ACE.jpg,140.0,140.0,"How do I get rid of frizz? This is my hair after I wash, do the LOC method, diffuse, and sleep in two braids. Any advice? I just want defined curls.",https://i.redd.it/vfn4lqpcieq41.jpg,all_ads,6,False,t2_548xcibj,,,{},True,False,,,[],0.0,False,,[],,,False,,
67,whoriel,,[],,text,False,False,1587500051,self.curlyhair,https://www.reddit.com/r/curlyhair/comments/g5mpqp/going_fully_natural/,,g5mpqp,True,False,False,True,False,#fb7f72,one,[],762e5196-21dd-11e6-90ce-0ebfe7658481,help,light,text,False,False,True,0,0,False,all_ads,/r/curlyhair/comments/g5mpqp/going_fully_natural/,False,,,6,1587502683,,2,"after putting heat on my hair for like the past 10 years ive decided to embrace my curls finally, i really wanna do the loc method bc i love my curls being moisturized, does anyone here use coconut oil they recommend?? also tips in general!! i really wanna learn how to take care of my hair!!!!",True,False,False,curlyhair,t5_2t79l,360181,public,self,,,going fully natural,https://www.reddit.com/r/curlyhair/comments/g5mpqp/going_fully_natural/,all_ads,6,False,t2_4j9oxvge,,,{},True,False,,,[],0.0,False,,[],,,False,[],
68,alreadytaken6969,,[],,text,False,False,1588226565,self.curlyhair,https://www.reddit.com/r/curlyhair/comments/gaq57a/humectants_question/,,gaq57a,True,False,False,True,False,#fb7f72,one,[],762e5196-21dd-11e6-90ce-0ebfe7658481,help,light,text,False,False,True,1,0,False,all_ads,/r/curlyhair/comments/gaq57a/humectants_question/,False,,,6,1588226568,,1,"Help!! I still don’t really understand the deal with humectants. If I live in a hot/humid climate (Deep South) with high porosity color treated hair that’s often very dry, do I want ingredients that pull moisture into my hair or not? I understand they pull moisture from the air into the hair but isn’t that a good thing for dry hair? 

Current routine (changes slightly - still trying to figure out what products/ingredients/applications work for me.

-cowash with As I Am Coconut Cowash. First time doing this but no problems so far. I was using Shea Moisture Hibiscus Shampoo &amp; Conditioner


-deep condition (always bc dry). Was using Mielle Babbasu &amp; Mint deep conditioner but ran out so I’ve been using Aussie 3 minute deep conditioner and not loving it. Squish to condish and let sit for anywhere from 10-30 minutes

-Cantu Leave in - I’ve tried a few leave ins and this one doesn’t seem to work as well. It seems like I need a lot of it. 


- Cantu curl cream - I LOVE this stuff


- I’ve learned I need gel since I’m pretty wavy. I haven’t branched out a lot here - LA looks or Giovanni L.A Natural Strong Hold Gel (hate the smell - won’t repurchase). 



I’ve tried LOC method where I’ll use Argon oil after cream and before gel. I also have a dry/itchy scalp if I go too long between wash days and find I have to clarify like once every month and a half or so. 

Really any advice to help lock in moisture and any guidance on what products to try or what ingredient to look for/stay away from would be helpful.

I’m on mobile so sorry for bad formatting/grammar. 

Thanks!!!",True,False,False,curlyhair,t5_2t79l,365131,public,self,,,Humectants Question,https://www.reddit.com/r/curlyhair/comments/gaq57a/humectants_question/,all_ads,6,False,t2_6b321xw,,,{},True,False,,,[],0.0,False,,[],,,False,[],1.0
69,who_angel,,[],,text,False,False,1590278486,self.curlyhair,https://www.reddit.com/r/curlyhair/comments/gpfk9r/would_i_need_a_leave_in_and_a_butter_or_would/,,gpfk9r,True,False,False,True,False,#fb7f72,one,[],762e5196-21dd-11e6-90ce-0ebfe7658481,help,light,text,False,False,True,2,0,False,all_ads,/r/curlyhair/comments/gpfk9r/would_i_need_a_leave_in_and_a_butter_or_would/,False,,,6,1590278492,,1,"i have high porosity, coarse, dense, 3c hair. i used to do the lco/loc method (+ a gel), but i'm now switching to using a oil-based butter product to style and seal because it was just too many products for me. 
  what i'm wondering now is whether the leave in is a necessity if i'm using a product that has ingredients like aloe vera, butters and oils, protein, extracts, and basically everything i have in my leave ins. i know water is the best moisturizer and butters don't have a lot of that, but if i'm styling on soaking wet hair and spraying my hair with water everyday, do i really need a water-based product besides from just water? 
  i tried to look up people with my hair using butters and whether they use anything else, but all i'm finding is water-based ""butters"" like those camille rose ones. 
  i know i can only know by trying, but before i do, does anyone with hair similar to mine have any thoughts? (sorry for the length lol)",True,False,False,curlyhair,t5_2t79l,377944,public,self,,,would i need a leave in AND a butter or would water and the butter most likely be enough,https://www.reddit.com/r/curlyhair/comments/gpfk9r/would_i_need_a_leave_in_and_a_butter_or_would/,all_ads,6,False,t2_5unnjuxe,,,{},True,False,,,[],0.0,False,,[],,,False,[],1.0
70,anon_anon_non,,[],,text,False,False,1590453960,self.curlyhair,https://www.reddit.com/r/curlyhair/comments/gqmzab/dry_scalphair_frizz/,,gqmzab,True,False,False,True,False,#fb7f72,one,[],762e5196-21dd-11e6-90ce-0ebfe7658481,help,light,text,False,False,True,2,0,False,all_ads,/r/curlyhair/comments/gqmzab/dry_scalphair_frizz/,False,,,6,1590453965,,1,"hi guys! i (19f) have 3b/3c hair and what i think is low porosity. ive been trying to take care of my curls for about 3 years now, but without fail, i can’t see it getting better. my scalp is extremely dry, it just doesn’t produce sebum, or at least enough to do anything regarding my hair. so i was wondering if there were any tips for that? 

my next problem is my hair is extremely dry and frizzy. i do moisturizing/hydrating treatments weekly (with steaming) but as soon as i rinse the product out, my hair becomes dry and frizzy once again, almost immediately. it almost becomes to difficult to handle. ive tried the LOC method and the LCO method, and many others, but every time my hair dries i have half way defined curls and tons of frizz within minutes. Ive tried diffusing, plopping, shirt drying, finger combing, praying hands but ive officially lost hope. 

honestly at this point i feel like i have to start all over again, so any and all suggestions are much appreciated, thanks in advance!",True,False,False,curlyhair,t5_2t79l,379213,public,self,,,dry scalp/hair &amp; frizz,https://www.reddit.com/r/curlyhair/comments/gqmzab/dry_scalphair_frizz/,all_ads,6,False,t2_5476srd8,,,{},True,False,,,[],0.0,False,,[],,,False,[],1.0
