0,Sentence,Trigger,Multiclass
20170727_02DTVX_Prospectus_SD000000002362015714.pdf,"On each Loan Payment Date during the continuance of a Trigger Period, the Borrowers are required to remit to the lender (which remittance may include a direction to the lender to release funds from the Excess Cash Flow Reserve Account pursuant to “—Excess Cash Flow Reserve Account” below) for deposit into the Basic Carrying Costs Escrow Account an amount which, together with the funds applied on such Loan Payment Date from the Excess Cash Flow Reserve Account equals the following sum: (i) 1/12th of the property taxes that the lender reasonably estimates, based on information provided by the Borrowers, will be payable during the next ensuing 12 months, plus (ii) 1/12th of the insurance premiums that the lender reasonably estimates, based on information provided by the Borrowers, will be payable during the next ensuing 12 months (unless a blanket policy meeting certain requirements contained in the Loan Documents is in effect), plus (iii) 1/12 of the homeowner’s association fees that lender reasonably estimates, based on information provided by Borrower, will be payable during the next ensuing 12 months.",Unspecified,0
20170727_02DTVX_Prospectus_SD000000002362015714.pdf,"If at any time during the continuance of a Trigger Period, the lender reasonably determines that the amount in the Basic Carrying Costs Escrow Account will not be sufficient to accumulate the full amounts necessary to pay all installments of property taxes, insurance premiums and homeowner’s association fees by the date on which such amounts come due the Borrowers will be required to increase its monthly payments to the Basic Carrying Costs Escrow Account by the amount reasonably estimated as sufficient to achieve such accumulation.",Unspecified,0
20170727_02DTVX_Prospectus_SD000000002362015714.pdf,"Notwithstanding the terms and provisions of this section, Borrower will not be required to reserve any amounts for payment of insurance premiums as otherwise required by this Section for so long as (i) Borrower has provided Lender with evidence that insurance satisfying the requirements in the Loan Agreement been obtained under a blanket policy of insurance in accordance with the timeframes set forth in the Loan Agreement, and (ii) no Mortgage Loan Event of Default is continuing.",Loan default,0
20170727_02DTVX_Prospectus_SD000000002362015714.pdf,"A “Trigger Period” means (i) each period that commences when the debt yield, determined as of the last day of each of two consecutive fiscal quarters, is less than 6.25% and concludes when the debt yield, determined as of the last day of each of two consecutive fiscal quarters thereafter, is equal to or greater than 6.25% and (ii) the period commencing upon the borrower’s failure to deliver quarterly or annual financial reports and ending when such reports are delivered and they indicate that no other Trigger Period is ongoing.",Debt yield fall,0
20170727_02DTVX_Prospectus_SD000000002362015714.pdf,"During the continuance of a Trigger Period, so long as no Mortgage Loan Event of Default is continuing within three Business Days of Borrower’s written request (accompanied by reasonably adequate detail) and no more frequently than once every 2 weeks, the lender is generally required to cause disbursements from the Excess Cash Flow Reserve Account to pay costs and expenses in connection with the ownership, management and/or operation of the Property to the extent the amounts contained in the applicable collateral accounts, if any, are insufficient for such purpose, including, without limitation, disbursements for (i) shortfalls in Operating Expenses (including management fees under the Approved Management Agreement, (ii) shortfalls in the costs of any emergency repairs and/or remediation of life safety issues (including any related capital expenditures), which the lender will endeavor to fund within one Business Day, (iii) capital expenditures that are budgeted for such calendar month as set forth in the then applicable approved annual budget or otherwise approved by the lender (including required repairs or alterations or repairs to the Property required to comply with applicable law) and Approved Alterations, in each case, accompanied by a disbursement certificate, (iv) costs of restoring the Property following a casualty or condemnation in excess of available Loss Proceeds, provided such property is not being released from the Loan Agreement, (v) shortfalls in the payment of debt service under the Mortgage Loan to the extent cash flow from the Property is insufficient for such purpose, (vi) costs of purchasing the Interest Rate Cap Agreement, (vii) voluntary prepayment of the Mortgage Loan in accordance with “—Voluntary Prepayment” below, (viii) shortfalls in any required monthly contribution to the collateral accounts to the extent cash flow from the Property is insufficient for such purposes, (ix) prepayments by the Borrowers of amounts sufficient to cause debt yield (as calculated under the Loan Agreement) to exceed 6.25%, (x) fees and costs payable by the Borrowers to the lender under the Loan Documents, (xi) any legal, audit and accounting costs (including actual costs incurred directly or indirectly by for back office accounting) that are associated with the Borrowers or reasonably allocable to the Borrowers’ ownership of the Properties, up to an aggregate annual amount of $150,000, provided that such funds may not be used for legal fees incurred in connection with the enforcement of the Borrowers’ or any affiliates of the Borrowers’ rights pursuant to the Loan Documents, as applicable, (xii) an amount, if any, that is necessary enable BPP Alphabet REIT LLC to pay distributions to the extent necessary to maintain its status as a real estate investment trust, up to $100,000 per annum, (xiii) to the Operating Account, in the amount of any Leasing Commissions then due and payable, (xiv) to the Operating Account, in the amount of any vacant space preparation costs and marketing costs with respect to potential leasing at the Properties, up to $100,000 per annum, and (xv) to the Borrowers, such other items as are reasonably approved by the lender.",Loan default,0
20170727_02DTVX_Prospectus_SD000000002362015714.pdf,"Provided that no Mortgage Loan Event of Default is then continuing, the lender is required to release to the Operating Account all amounts then contained in the Excess Cash Flow Reserve Account within 10 Business Days after the termination of a Trigger Period.",Loan default,0
20170727_02DTVX_Prospectus_SD000000002362015714.pdf,Such a release will not preclude the subsequent commencement of a Trigger Period and the deposit of amounts into the Excess Cash Flow Reserve Account.,Unspecified,0
20170727_02DTVX_Prospectus_SD000000002362015714.pdf,"During the continuance of a Mortgage Loan Event of Default, the lender may, in its sole discretion, apply the funds in the reserve accounts, and funds resulting from the liquidation of permitted investments contained in the reserve accounts, either toward the components of the indebtedness and/or toward the payment of Property expenses.",Loan default,0
20170727_02DTVX_Prospectus_SD000000002362015714.pdf,"Pursuant to the lockbox account agreement, the Borrowers will have no access to funds in the Lockbox Account and (1) so long as no Trigger Period or Mortgage Loan Event of Default is continuing, the Lockbox Bank will, at the end of each Business Day (or at such frequency as requested by the Borrowers in their discretion) remit all amounts contained in the Lockbox Account directly into an account of the Borrowers, and (2) following the Lockbox Bank’s receipt of written notice from the lender (a “Sweep Notice”) the Lockbox Bank will, not less than two times per week (such frequency to be determined by Borrower while no Mortgage Loan Event of Default or Trigger Period is continuing and otherwise to be determined by lender) remit all amounts contained therein into the account specified in the Sweep Notice, which will be the account established by the Cash Management Bank pursuant to the Cash Management Agreement (the “Cash Management Account”).",Loan default,0
20170727_02DTVX_Prospectus_SD000000002362015714.pdf,"Within three Business Days after the lender becomes aware that no Trigger Period is continuing, or within three Business Days after the lender waives a Mortgage Loan Event of Default in writing in its sole discretion (provided that no Trigger Period is in effect following such waiver), as applicable, the lender will be required to provide notice to the Lockbox Bank that the Sweep Notice is no longer in effect and that all amounts in the Lockbox Account may be remitted at the end of each Business Day or at such frequency as requested by the Borrowers into an account of the Borrowers.",Loan default,0
20170727_02DTVX_Prospectus_SD000000002362015714.pdf,"In addition, during the continuance of a Mortgage Loan Event of Default or if the Lockbox Bank fails to comply with the lockbox account agreement or ceases to be an Eligible Institution, the lender has the right at any time, upon not less than 30 days’ prior written notice to the Borrowers, to replace the Lockbox Bank with any Eligible Institution at which Eligible Accounts may be maintained that will promptly execute and deliver to the lender a lockbox account agreement that is in the form of the existing lockbox account agreement or otherwise reasonably acceptable to the lender and the Borrowers, and the Borrowers are required to reasonably cooperate with the foregoing.",Loan default,0
20170727_02DTVX_Prospectus_SD000000002362015714.pdf,"If requested by the lender during the continuance of a Trigger Period, upon the opening of the Cash Management Account, the Borrowers are required to deliver to the lender an opinion of counsel reasonably satisfactory to the lender regarding the creation and perfection of the lender’s security interest in the accounts in which a security interest is granted under the Cash Management Agreement.",Unspecified,0
20170727_02DTVX_Prospectus_SD000000002362015714.pdf,"On each Loan Payment Date during the continuance of a Trigger Period, provided that no Mortgage Loan Event of Default is continuing (and, if and to the extent the lender so elects in its sole discretion, during the continuance of a Mortgage Loan Event of Default until the Mortgage Loan has been accelerated), the lender is required to transfer amounts from the Cash Management Account, to the extent available, to make the following payments in the following order of priority: (i) to the Basic Carrying Costs Escrow Account, the amount required to be deposited in such account as described in “—Reserve Accounts” above; (ii) to the lender, the amount of all scheduled or delinquent interest on the Mortgage Loan and all other amounts then due and payable under the Loan Documents; (iii) to the Operating Account, any amount specified by the Borrowers in writing at least three Business Days prior to such Mortgage Loan Payment date that is required to pay unpaid Operating Expenses in accordance with the Approved Annual Budget; and (iv) all remaining amounts to an excess cash flow reserve as described in “Description of the Mortgage Loan—Reserve Accounts—Excess Cash Flow Reserve Account”.",Loan default,0
20170727_02DTVX_Prospectus_SD000000002362015714.pdf,"If on any Loan Payment Date during a Trigger Period, the amount in the Cash Management Account is insufficient to make all the transfers described in clauses (i) through (v) above, then the lender is required to remit funds from the Excess Cash Flow Reserve Account into the Cash Management Account up to the amount of such deficiency; provided that if a deficiency still exists after giving effect to such remittance from the Excess Cash Flow Reserve Account (or if no funds are then on deposit in the Excess Cash Flow Reserve Account), such insufficiency will not relieve the Borrowers of the obligations to make any payments and remittances as and when due under the Loan Agreement and the other Loan Documents.",Unspecified,0
20170727_02DTVX_Prospectus_SD000000002362015714.pdf,"The Borrowers are permitted to avoid the commencement or terminate the continuance of a Trigger Period by either (i) making a prepayment or defeasance of the Mortgage Loan in accordance with the terms of the Loan Agreement in an amount that when subtracted from the principal balance of the Mortgage Loan then outstanding for purposes of calculating debt yield would result in a debt yield (as calculated under the Loan Agreement) that equals or exceeds 6.25% (provided that in the event of such prepayment or defeasance, the Trigger Period will cease promptly upon prepayment or defeasance of such amount that is adequate to satisfy 6.25%), together with all of the other amounts required pursuant to “—Voluntary Prepayment” below, or (ii) delivering to the lender, as additional Collateral, a letter of credit in an amount that when subtracted from the principal balance of the Mortgage Loan then outstanding for purposes of calculating debt yield would result in a debt yield (as calculated under the Loan Agreement) that equals or exceeds 6.25% (provided that the aggregate notional amount of all outstanding letters of credit delivered under the Loan Agreement at no time may exceed 10% of the principal balance of the Mortgage Loan then outstanding).",Debt yield fall,0
20170727_02DTVX_Prospectus_SD000000002362015714.pdf,"Provided that no Mortgage Loan Event of Default is then continuing, following written request from the Borrowers, the lender is required to return such letter of credit upon the conclusion of the second of any two consecutive fiscal quarters if debt yield (as calculated under the Loan Agreement), determined as of the last day of each such fiscal quarter, is equal to or greater than 6.25%, in each case without reducing the principal balance of the Mortgage Loan then outstanding by the amount of such letter of credit for purposes of calculating debt yield.",Loan default,0
20170727_02DTVX_Prospectus_SD000000002362015714.pdf,"For so long as no Trigger Period or event of default under the Mortgage Loan is continuing, all funds in the lockbox account are required to be swept into a borrower-controlled account on a daily basis (or at such frequency as may be requested by Borrower in its discretion). ",Loan default,0
20170727_02DTVX_Prospectus_SD000000002362015714.pdf,"During the continuance of a Trigger Period or event of default under the Mortgage Loan, all amounts in the lockbox account are required to be swept no less than two times per week to a cash management account established and maintained by the Borrowers for the benefit of the lender as the secured party (the “Cash Management Account”).",Loan default,0
20170727_02DTVX_Prospectus_SD000000002362015714.pdf,"During the continuance of a Trigger Period or an event of default, all excess cash flow (after payment of all debt service, required reserves and certain operating expenses) will be deposited to an excess cash flow reserve account.",Loan default,0
20170727_02DTVX_Prospectus_SD000000002362015714.pdf,"A “Trigger Period” means (i) each period that commences when the debt yield, determined as of the last day of each of two consecutive fiscal quarters, is less than 6.25% and concludes when the debt yield, determined as of the last day of each of two consecutive fiscal quarters thereafter, is equal to or greater than 6.25% and (ii) the period commencing upon the borrower’s failure to deliver quarterly or annual financial reports and ending when such reports are delivered and they indicate that no other Trigger Period is ongoing.",Debt yield fall,0
20170727_02DTVX_Prospectus_SD000000002362015714.pdf,"On each loan payment date during the continuance of a Trigger Period, the borrowers are required to fund a tax, insurance and homeowner’s association fees reserve in an amount equal to one-twelfth of the amount that the lender reasonably estimates will be necessary to pay taxes, insurance premiums and homeowner’s association fees over the then succeeding 12-month period.",Unspecified,0
20170727_02DTVX_Prospectus_SD000000002362015714.pdf,"In addition, on each due date during the continuance of a Trigger Period, the related loan documents require an excess cash flow reserve as discussed under “—Lockbox and Cash Management” above.",Unspecified,0
20170727_02DTVX_Prospectus_SD000000002362015714.pdf,"For so long as no Trigger Period or Mortgage Loan Event of Default, is continuing, all funds in the lockbox account are required to be swept into a borrower-controlled operating account on a daily basis (or at such frequency as is requested by Borrower in its discretion).",Loan default,0
20170727_02DTVX_Prospectus_SD000000002362015714.pdf,"During the continuance of a Trigger Period or Mortgage Loan Event of Default, all amounts in the lockbox account are required to be swept no less than two times per week to a cash management account established and maintained by the Borrowers for the benefit of the lender as the secured party (the “Cash Management Account”).",Loan default,0
20170727_02DTVX_Prospectus_SD000000002362015714.pdf,"A “Trigger Period” means (i) each period that commences when the debt yield, determined as of the last day of each of two consecutive fiscal quarters, is less than 6.25% and concludes when the debt yield, determined as of the last day of each of two consecutive fiscal quarters thereafter, is equal to or greater than 6.25% and (ii) the period commencing upon the borrower’s failure to deliver quarterly or annual financial reports and ending when such reports are delivered and they indicate that no other Trigger Period is ongoing.",Debt yield fall,0
20170727_02DTVX_Prospectus_SD000000002362015714.pdf,"The Loan Documents require the Borrowers to maintain and fund the following reserve accounts, each of which are subaccounts of the Cash Management Account:  upon the occurrence of a casualty or condemnation, an account for the purpose of depositing any net proceeds of a casualty or condemnation; and during a Trigger Period, the Borrowers are required to fund on each Loan Payment Date until no Trigger Period exists: an account for all amounts payable in respect of property taxes, insurance premiums and homeowner’s association fees (the “Basic Carrying Costs Escrow Account”), an amount equal to the sum of (a) 1/12th of projected annual property taxes, (b) 1/12th of projected annual insurance premiums (unless a blanket policy meeting certain requirements contained in the Loan Documents is in effect and no Mortgage Loan Event of Default is continuing) and (c) 1/12th of the homeowner’s association fees that lender reasonably estimates, based on information provided by Borrower, will be payable during the next ensuing 12 months; an account for excess cash flow (after payment of all required debt service, reserves and operating expenses) as described under “Description of the Mortgage Loan—Cash Management” in the Offering Circular.  ",Loan default,0
20170727_02DTVX_Prospectus_SD000000002362015714.pdf,"If no Mortgage Loan Event of Default is continuing, amounts in the Excess Cash Flow Reserve Account will be released to the Borrower’s operating account within 10 Business Days after the termination of a Trigger Period.",Loan default,0
20170801_02DX5C_Prospectus_SD000000002363000910.pdf,"Upon the first occurrence of a Trigger Period, the Mortgage Lender, on behalf of the Borrowers, is required to establish a cash management account (a “Cash Management Account”), which Cash Management Account will be in the name of the Borrowers for the sole and exclusive benefit of the Mortgage Lender.",Unspecified,0
20170801_02DX5C_Prospectus_SD000000002363000910.pdf,"To the extent that a Trigger Period has occurred and is continuing, on each Payment Date, the Lender or Servicer, as applicable, is required to allocate all funds, if any, on deposit in the Cash Management Account and disburse such funds in the amounts and order of priority as described under “DESCRIPTION OF THE MORTGAGE LOANS—Cash Management Account” in this Offering Circular.",Unspecified,0
20170801_02DX5C_Prospectus_SD000000002363000910.pdf,"Upon the first occurrence of a Trigger Period, the Mortgage Lender, on the Borrowers’ behalf, is required to also establish with the Mortgage Lender or the Servicer an eligible account (a “Debt Service Account”) into which the Borrowers are required to deposit, or cause to be deposited, the amounts required for the payment of debt service under the Mortgage Loan.",Unspecified,0
20170801_02DX5C_Prospectus_SD000000002363000910.pdf,"Prior to the occurrence and continuance of a Mortgage Loan Event of Default, funds on deposit in the Debt Service Account, if any, are required to be used to pay debt service when due, together with any late payment charges. See “DESCRIPTION OF THE MORTGAGE LOANS—Restricted Account” in this Offering Circular.",Loan default,0
