0,Sentence,Trigger,Multiclass
20120828_01Y0R8_Prospectus_CM000000002058750876.pdf,"On each Business Day, the financial institution maintaining the blocked account (which was U.S. Bank National Association as of the Origination Date) is required to remit all funds on deposit in the blocked account (a) if no Trigger Period or event of default under the Mortgage Loan is continuing, to the Borrower and (b) during a Trigger Period or while an event of default under the Mortgage Loan is continuing, to the Cash Management Account.",Loan Default,0
20120828_01Y0R8_Prospectus_CM000000002058750876.pdf,"The Borrower has established and is required to maintain a cash management account (the “Cash Management Account”) at the Cash Management Bank into which income from the Property (other than certain de minimis non-core and sponsorship income) is required to be deposited during any period that the aggregate debt service coverage ratio (based on net operating income, as calculated under the Loan Documents) for the trailing 12-month period as of the most recent fiscal quarter and annualized debt service (including any scheduled amortization), falls below 1.30x as of the end of any fiscal quarter until such debt service coverage ratio exceeds 1.30x as of the end of the trailing 12-month period for two consecutive fiscal quarters (such period a “Trigger Period”), or while an event of default under the Mortgage Loan is continuing. ",Aggregate DSCR Fall,1
20120828_01Y0R8_Prospectus_CM000000002058750876.pdf,"The Borrower has established and is required to maintain a cash management account (the “Cash Management Account”) at the Cash Management Bank into which income from the Property (other than certain de minimis non-core and sponsorship income) is required to be deposited during any period that the aggregate debt service coverage ratio (based on net operating income, as calculated under the Loan Documents) for the trailing 12-month period as of the most recent fiscal quarter and annualized debt service (including any scheduled amortization), falls below 1.30x as of the end of any fiscal quarter until such debt service coverage ratio exceeds 1.30x as of the end of the trailing 12-month period for two consecutive fiscal quarters (such period a “Trigger Period”), or while an event of default under the Mortgage Loan is continuing. ",Loan Default,1
20120828_01Y0R8_Prospectus_CM000000002058750876.pdf,"During a Trigger Period or while an event of default under the Mortgage Loan is continuing, all amounts available in the Cash Management Account will be applied on each Loan Payment Date in the following order of priority: (i) to the Tax and Insurance Reserve Account, (a) 1/12th of projected annual taxes and (b) 1/12th of projected annual insurance premiums (unless certain blanket policies are in effect), (ii) to the lender, the amount of all scheduled or delinquent interest and principal on the Mortgage Loan and all other amounts then due and payable under the Loan Documents (with amounts in respect of principal paid last), (iii) provided there has been no enforcement action, after the occurrence and during the continuance of an event of default under the Mortgage Loan, to operating accounts, an amount equal to the budgeted operating expenses for the month in which such Loan Payment Date occurs (as described in “Description of the Mortgage Loan—Cash Management”); (iv) to the Capital Expenditure Reserve Account,􀀃an amount equal to the lesser of (a) $9,018 (which is $0.15 per owned rentable square foot per annum) or (b) the amount that would cause the total amount contained in the Capital Expenditure Reserve Account to equal $108,216 (which is 12 times the monthly required amount set forth in clause (a)), (v) to the TI/LC Reserve Account an amount equal to the lesser of (a) $60,120 (which is $1.00 per owned rentable square foot per annum) or (b) the amount that would cause the total amount contained in the Capital Expenditure Reserve Account to equal $721,438 (which is 12 times the monthly required amount set forth in clause (a)), and (vi) unless an event of default under the Loan Documents is continuing, all remaining amounts to the Borrower.",Loan Default,0
20120828_01Y0R8_Prospectus_CM000000002058750876.pdf,On any Business Day all amounts on deposit in the Cash Management Account in excess of the amount of required reserves and all other amounts due and payable on the next Loan Payment Date will be released to the Borrower unless an event of default under the Mortgage Loan has occurred and is continuing.,Loan Default,0
20120828_01Y0R8_Prospectus_CM000000002058750876.pdf,"Available funds in each Cash Management Account are required to be swept into either the Operating Accounts, or upon the commencement of a Trigger Period or Event of Default, the Cash Management Account at the end of each Business Day.",Loan Default,0
20120828_01Y0R8_Prospectus_CM000000002058750876.pdf,"So long as no Trigger Period or Event of Default is continuing, at the end of each Business Day, all amounts contained in the Lockbox Account will be required to be disbursed to the Borrower’s designated operating account or as Borrower otherwise directs.",Loan Default,0
20120828_01Y0R8_Prospectus_CM000000002058750876.pdf,"During the continuance of a Trigger Period or Event of Default, at the end of each Business Day, all amounts contained in the Lockbox Account will be required to be transferred to the Cash Management Account.",Loan Default,0
20120828_01Y0R8_Prospectus_CM000000002058750876.pdf,"“Trigger Period” means any period that the debt service coverage ratio (based on net operating income for the trailing 12-month period (less tenant improvement and leasing commission expenditures equal to $1.00 per square foot per annum and capital improvements equal to $0.20 per square foot per annum) and debt service on the Mortgage Loan), falls below 1.30x as of the end of any fiscal quarter until such debt service coverage ratio is at least 1.30x as of the end of a subsequent fiscal quarter.",DSCR Fall,0
20120828_01Y0R8_Prospectus_CM000000002058750876.pdf,"During the continuance of a Trigger Period, the Cash Management Bank will remit to the Borrower, at the end of each Business Day (or, at the election of the Borrower, on a less frequent basis), the amount, if any, by which amounts then contained in the Cash Management Account exceed the aggregate amount required to be paid to or reserved with the lender on the next Loan Payment Date pursuant to the Mortgage Loan Agreement (the “Minimum Balance”); provided, however, that the lender will terminate such remittances during the continuance of an Event of Default upon notice to the Cash Management Bank with a copy to the Borrower.",Loan Default,0
20120828_01Y0R8_Prospectus_CM000000002058750876.pdf,"On each Loan Payment Date, during the continuance of a Trigger Period or an Event of Default, the lender is required to transfer amounts from the Cash Management Account, to the extent available, to make the following payments in the following order of priority: (i) to a designated reserve account (the “Tax and Insurance Reserve Account” ), an amount equal to the sum of (a) 1/12th of projected annual real estate taxes, and (b) 1/12th of projected annual insurance premiums (the foregoing insurance reserve requirement is waived so long as insurance is maintained under a blanket policy) for the purpose of reserving amounts in respect of taxes and insurance premiums during the continuance of a Trigger Period or an Event of Default; (ii) to the lender, the amount of all scheduled or delinquent interest and principal on the Mortgage Loan and all other amounts then due and payable under the Loan Documents (with amounts in respect of principal paid last); (iii) provided no Enforcement Action has occurred and is continuing, after the occurrence and during the continuance of an Event of Default, to Operating Accounts, an amount equal to the Budgeted Operating Expenses for the month in which such Loan Payment Date occurs, provided that (A) the amounts disbursed to such account pursuant to this clause (iii) will be used by Borrower solely to pay Budgeted Operating Expenses for such month, (B) no amounts will be disbursed to Borrower in respect of the fees of any manager of the Property to the extent such fees exceed 2% of the gross income from operations at the Property, (C)(1) no remittances will be made to pay any affiliate of the Borrower or the Sponsor pursuant to any contract or agreement from and after such time as the lender requests that the same be terminated (excluding (a) amounts accrued prior to such termination notice and (b) reimbursements for amounts appropriately paid by such affiliate to non-affiliates), (2) the lender may elect, in its sole discretion, to make direct remittances to parties that are owed amounts in accordance with the approved annual budget rather than remitting such amounts to Operating Accounts (which may include the Borrower if the Borrower is then self-managing the Property and the lender has not elected to terminate the Borrower in such role) and (3) to the extent that the lender elects to remit amounts to the Operating Accounts, the remittance will be conditioned on the lender’s receipt of a monthly certification confirming that all amounts previously remitted into the Operating Accounts during the continuance of such Event of Default either remain in the Operating Accounts or have been applied toward specified Budgeted Operating Expenses, and (D) during the continuance of an Event of Default, the lender receives a perfected, first-priority security interest in the Operating Account into which such amounts will be funded; (iv) to a designated reserve account (the “Capital Expenditure Reserve Account” ), an amount equal to an amount equal to the lesser of (i) 1/12th of $0.15 per leasable square foot at the Property (i.e., $9,018) or (ii) the amount that would cause the total amount contained in the Capital Expenditure Reserve Account to equal 12 times the monthly required amount (i.e., $108,216) for the purpose of reserving amounts in respect of capital expenditures during the continuance of a Trigger Period or an Event of Default; (v) to a designated reserve account (the “TI/LC Reserve Account” ), an amount equal to an amount equal to the lesser of (i) 1/12th of $1.00 per leasable square foot at the Property (i.e., $60,120) or (ii) the amount that would cause the total amount contained in the TI/LC Reserve Account to equal 12 times the monthly required amount (i.e., $721,438) for the purpose of reserving amounts in respect of tenant improvements and leasing commissions during the continuance of a Trigger Period or an Event of Default; (vi) to the lender, the amount of any other amounts then due and payable to the lender under the Loan Documents; (vii) during the continuance of an Event of Default, all remaining amounts shall be retained by the lender to be to be held as additional collateral for the Mortgage Loan and, upon acceleration of the Mortgage Loan, such amounts may be applied in its discretion; and (viii) if no Event of Default is continuing, all remaining amounts to an account specified by the Borrower.",Loan Default,0
20120828_01Y0R8_Prospectus_CM000000002058750876.pdf,"Upon the termination of a Trigger Period, provided no Event of Default is then continuing, the lender will remit to Borrower the amounts then on deposit in each of the reserve funds other than reserves for outstanding tenant improvements and leasing commissions.",Loan Default,0
20120828_01Y0R8_Prospectus_CM000000002058750876.pdf,"“Budgeted Operating Expenses” means, with respect to any calendar month, (i) an amount equal to the Operating Expenses for such calendar month in the then-applicable approved annual budget, or (ii) such greater amount equal to the actual Operating Expenses of the Borrower for such month, provided such greater amount may in no event exceed 110% of the amount specified in clause (i) without the prior written consent of the lender (which, in the absence of a monetary Event of Default or Enforcement Action, will not be unreasonably withheld or delayed; provided, however, in the event that a budget shall not have been approved by the lender at any time that a disbursement of funds for Budgeted Operating Expenses is required, then the amount of Budgeted Operating Expenses shall be subject to the reasonable approval of the lender.",Loan Default,0
20120828_01Y0R8_Prospectus_CM000000002058750876.pdf,"So long as no Event of Default is then continuing, funds in the reserve accounts will be invested at the discretion of the Borrower, but only in certain investments meeting certain Rating Agency criteria.",Loan Default,0
20120828_01Y0R8_Prospectus_CM000000002058750876.pdf,"During the continuance of an Event of Default and acceleration of the Mortgage Loan, the lender may, in its sole discretion, apply funds in the reserve accounts, and funds resulting from the liquidation of permitted investments contained in the reserve accounts, either toward the Mortgage Loan and/or toward the payment of Property expenses.",Loan Default,0
20120828_01Y0R8_Prospectus_CM000000002058750876.pdf,"Funds in the blocked account are applied (a) if no Trigger Period or event of default under the Mortgage Loan is continuing, to an account designated by the Borrower and (b) during a Trigger Period or while an event of default under the Mortgage Loan is continuing, a separate cash management account.",Loan Default,0
20120828_01Y0R8_Prospectus_CM000000002058750876.pdf,"The term “Trigger Period” means any period that the debt service coverage ratio (based on net operating income for the trailing 12-month period (less TI/LC expenditures equal to $1.00 per square foot per annum and capital improvements equal to $0.20 per square foot per annum) and the Mortgage Loan debt service), falls below 1.30x as of the end of any fiscal quarter until such debt service coverage ratio is at least 1.30x as of the end of a subsequent fiscal quarter.",DSCR Fall,0
20120828_01Y0R8_Prospectus_CM000000002058750876.pdf,"During a Trigger Period or while an event of default under the Mortgage Loan is continuing, all amounts available in the Cash Management Account will be applied on each Loan Payment Date in the following order of priority: (a) to the Tax and Insurance Reserve Account, an amount equal to the sum of (i) 1/12th of projected annual real estate taxes, and (ii) 1/12th of projected annual insurance premiums (unless certain blanket policies are in effect); (b) to the Lender, the amount of all scheduled or delinquent interest and principal on the Loan and all other amounts then due and payable under the Mortgage Loan Documents (with amounts in respect of principal paid last); (c) provided there has been no enforcement action under the Mortgage Loan, during the continuance of an Event of Default, to the Borrower’s operating account, an amount equal to the operating expenses, subject to certain limitations; (d) to the Capital Expenditure Reserve Account, an amount equal to $15,030, capped at $180,360;(e) to the TI/LC Reserve Account, an amount equal to $60,120, capped at $721,438.",Loan Default,0
20120828_01Y0R8_Prospectus_CM000000002058750876.pdf,"After an acceleration of the loan after an event of default under the Mortgage Loan Documents, all remaining amounts shall be retained by Lender to be applied in its discretion.",Loan Default,0
20120828_01Y0R8_Prospectus_CM000000002058750876.pdf,"If no event of default under the Mortgage Loan Documents is continuing, all remaining amounts will be distributed to an account specified by Borrower.",Loan Default,0
20150307_028S2X_Prospectus_SD000000002389024187.pdf,"Except during a Cash Management Period, funds in the Lockbox Account are required to be disbursed to the Borrowers on a daily basis.",Unspecified,0
20150307_028S2X_Prospectus_SD000000002389024187.pdf,"During the continuance of any Cash Management Period, funds in the Lockbox Account are required to be swept into a Cash Management Account under the sole dominion and control of the Lender.",Unspecified,0
20150307_028S2X_Prospectus_SD000000002389024187.pdf,"During the continuance of a Cash Management Period (other than one caused by an event of default under the Whole Loan), funds deposited into the Cash Management Account are required to be applied on each Loan Payment Date in the following order of priority: (i) to a tax reserve account, an amount equal to 1/12 of projected annual real estate taxes; (ii) to an insurance reserve account, an amount equal to 1/12 of projected annual insurance premiums, which escrow will be waived if the Property is covered by satisfactory “blanket” policies; (iii) to the Lender, any unpaid default interest or late payment fees; (iv) to the Lender, the monthly principal and interest payment (provided during the Extension Term, only to the extent of interest calculated at the Initial Interest Rate and the Initial B Note Interest Rate); (v) to the Cash Management Bank, any fees payable in connection with its serving in such capacity; (vi) during a Cash Trap Period, to the Borrower’s operating account, an amount equal to approved monthly operating expenses for the Property; (vii) to a capital expenditure reserve account, a monthly amount equal to $24,369.30; (viii) to a rollover reserve account, a monthly amount equal to $182,770.75; (ix) other than during the Extension Term, during a Cash Trap Period, to the excess cash flow account, all amounts remaining after deposits for items (i) through (viii) above; (x) other than during the Extension Term, provided a Cash Trap Period is not then continuing, all amounts remaining after deposits for items (i) through (ix) above will be disbursed to Borrowers; (xi) during the Extension Term, funds sufficient to pay the remaining portion of the monthly debt service amount; (xii) during the Extension Term, all amounts remaining after deposits for items (i) through (xi) above shall pay any outstanding Excess Interest then due and payable; and (xiii) during the Extension Term, all amounts remaining after deposits for items (i) through (xii) above shall be applied to repay the outstanding principal balance of the Whole Loan on a pari passu basis.",Loan Default,0
20150307_028S2X_Prospectus_SD000000002389024187.pdf,"After the occurrence and during the continuance of any event of default under the Whole Loan, amounts in the Cash Management Account may be applied by Lender in its sole discretion.",Loan Default,0
20150307_028S2X_Prospectus_SD000000002389024187.pdf,"During the continuance of a Cash Trap Period (other than one caused by an event of default under the Whole Loan), amounts on deposit in the excess cash flow account are required to be made available to the Borrowers for the payment of tenant improvement costs, tenant improvement allowances and leasing commissions incurred with respect to any space at the Property.",Loan Default,0
20150307_028S2X_Prospectus_SD000000002389024187.pdf,"During the continuance of a Cash Trap Period caused by an event of default under the Whole Loan, amounts on deposit in the excess cash flow account may be applied by the Lender in its sole discretion during the continuance of such event of default.",Loan Default,0
20150307_028S2X_Prospectus_SD000000002389024187.pdf,"“Cash Management Period”” means (i) from and after the occurrence of any event of default under the Whole Loan, until such time as such event of default has been cured; and (ii) from and after the last day of any calendar quarter on which the Debt Service Coverage Ratio is less than 1.75x, until such time as the Debt Service Coverage Ratio is at least 1.75x for two consecutive calendar quarters.",Loan Default,1
20150307_028S2X_Prospectus_SD000000002389024187.pdf,"“Cash Management Period”” means (i) from and after the occurrence of any event of default under the Whole Loan, until such time as such event of default has been cured; and (ii) from and after the last day of any calendar quarter on which the Debt Service Coverage Ratio is less than 1.75x, until such time as the Debt Service Coverage Ratio is at least 1.75x for two consecutive calendar quarters.",DSCR Fall,1
20150307_028S2X_Prospectus_SD000000002389024187.pdf,"“Cash Trap Period” means (i) from and after the occurrence of any event of default under the Whole Loan, until such time as such event of default has been cured; and (ii) from and after the last day of any calendar quarter on which the Debt Service Coverage Ratio is less than 1.25x, until such time as the Debt Service Coverage Ratio is at least 1.30x for two consecutive calendar quarters.",Loan Default,1
20150307_028S2X_Prospectus_SD000000002389024187.pdf,"“Cash Trap Period” means (i) from and after the occurrence of any event of default under the Whole Loan, until such time as such event of default has been cured; and (ii) from and after the last day of any calendar quarter on which the Debt Service Coverage Ratio is less than 1.25x, until such time as the Debt Service Coverage Ratio is at least 1.30x for two consecutive calendar quarters.",DSCR Fall,1
20150307_028S2X_Prospectus_SD000000002389024187.pdf,"No reserve accounts were funded by the Borrowers at origination; however, monthly deposits to certain reserve accounts will be required during the continuance of a Cash Management Period or upon the Borrower’s receipt of certain lease termination fees.",Unspecified,0
20150307_028S2X_Prospectus_SD000000002389024187.pdf,"Unless a Cash Management Period has occurred and is continuing, available funds in the Lockbox Account are required to be swept daily into a Borrower-controlled operating account.",Unspecified,0
20150307_028S2X_Prospectus_SD000000002389024187.pdf,"The Borrowers are required to deliver to each tenant in the Property a written notice instructing that all payments under the leases are to be transmitted by them to a Lockbox Account (provided Borrowers are not required to cause SL Green Management LLC , as a tenant at the Property, to deposit rent payable by to the Borrowers into the Lockbox Account except during the continuance of an Event of Default).",Loan Default,0
20150307_028S2X_Prospectus_SD000000002389024187.pdf,"On each Business Day of each month, provided no Cash Management Period has occurred and is continuing, the Cash Management Bank will be required to cause amounts on deposit in the Lockbox Account to be disbursed to the Borrowers.",Unspecified,0
20150307_028S2X_Prospectus_SD000000002389024187.pdf,"During the continuance of a Cash Management Period, the Cash Management Bank will be required to cause amounts on deposit in the Lockbox Account to be swept into a cash management account under the sole dominion and control of the Lender (the “Cash Management Account”) maintained at the Cash Management Bank pursuant to the terms of a cash management agreement (the “Cash Management Agreement”).",Unspecified,0
20150307_028S2X_Prospectus_SD000000002389024187.pdf,"During the continuance of a Cash Management Period (other than one caused by an Event of Default), the Cash Management Bank will be required to withdraw all available funds on deposit in the Cash Management Account on each Business Day and disburse such funds in the following amounts and order of priority: (i) first, to the tax subaccount of the Cash Management Account, an amount sufficient to fund the required monthly deposit for payment of taxes; (ii) second, unless the Property is covered by a blanket insurance policy, to the insurance subaccount of the Cash Management Account, an amount sufficient to fund the required monthly deposit for payment of insurance premiums; (iii) third, to the debt service subaccount of the Cash Management Account, the amount of any interest accruing at the Default Rate and late payment charges; (iv) fourth, to the debt service subaccount of the Cash Management Account, the monthly debt service amount (provided during the Extension Term this shall only be the interest calculated at the Initial Interest Rate and the Initial B Note Interest Rate); (v) fifth, to the Cash Management Bank, the Cash Management Bank’s fees; (vi) sixth, during a Cash Trap Period (and at all times during the Extension Term), to the Borrowers, an amount equal to the operating expenses reasonably approved by the Lender for the month in which such Loan Payment Date occurs; (vii) seventh, to the capital expenditure subaccount of the Cash Management Account, a monthly amount equal to $24,369.30; (viii) eighth, to the rollover subaccount of the Cash Management Account, a monthly amount equal to $182,770.75; (ix) ninth, other than during the Extension Term, during a Cash Trap Period, to the excess cash flow account, all amounts remaining in the Cash Management Account after deposits for items (i) through (vii) above; (x) tenth, other than during the Extension Term, provided a Cash Trap Period is not then continuing, all amounts remaining in the Cash Management Account after deposits for items (i) through (ix) above will be disbursed to the Borrowers; (xi) eleventh, during the Extension Term, funds sufficient to pay the remaining portion of the monthly debt service amount; (xii) twelfth, during the Extension Term, all amounts remaining in the Cash Management Account after deposits for items (i) through (xi) above (the “Available Cash Flow”) shall pay any outstanding Excess Interest then due and payable; and (xiii) thirteenth, during the Extension Term, all amounts remaining in the Cash Management Account after deposits for items (i) through (xii) above shall be applied to repay the outstanding principal balance of the Whole Loan on a pari passu basis.",Loan Default,0
